"","Sequence","prot_acc","Modifications","col-0.1","col-0.2","col-0.3","col-0.4","clp1.1","clp1.2","clp1.3","clp1.4","clp2.1","clp2.2","clp2.3","clp2.4","clp1/col-0 Ratio","clp1/col-0 TTEST","clp1/col-0 REGULATION","clp2/col-0 Ratio","clp2/col-0 TTEST","clp2/col-0 REGULATION","gene","Gene Model Name","Gene Model Type","ID","name","clp1p__vs_wtp__p.adj","clp2p__vs_wtp__p.adj","clp1p__vs_wtp__ratio","clp2p__vs_wtp__ratio","clp1s__vs_wts__p.adj","clp2s__vs_wts__p.adj","clp1s__vs_wts__ratio","clp2s__vs_wts__ratio"
"2","aASAEIDAEIQQQLTNEVkLFNR","AT2G37270.2","N-Term(Acetyl); K19(iTRAQ8plex)",1.2,1.08,1,1.05,1.65,0.91,1.4,0.92,0.9,0.92,0.9,1,1.13,0.51,0,0.86,0.51,0,"AT2G37270","One of two genes encoding the ribosomal protein S5. Expressed at a lower level compared to ATRPS5A.","RIBOSOMAL PROTEIN 5B (RPS5B)","AT2G37270.2","RPS5A",0.662,0.851,-0.411,-0.264,0.761,0.614,0.249,-0.7
"3","aASAEIDAEIQQQLTNEVkLFNR","AT2G37270.2","N-Term(Acetyl); K19(iTRAQ8plex)",1.2,1.08,1,1.05,1.65,0.91,1.4,0.92,0.9,0.92,0.9,1,1.13,0.51,0,0.86,0.51,0,"AT2G37270","One of two genes encoding the ribosomal protein S5. Expressed at a lower level compared to ATRPS5A.","RIBOSOMAL PROTEIN 5B (RPS5B)","AT2G37270.2","RPS5B",0.294,0.836,-0.846,-0.324,0.748,0.627,0.249,-0.604
"10","aGIkVFGHPASIATRR","AT4G02520.1","N-Term(Acetyl); K4(iTRAQ8plex)",0.99,2.15,1.25,1.14,1.06,1.01,1.03,0.79,0.94,0.84,0.97,0.85,0.7,0.21,0,0.65,0.21,0,"AT4G02520","Encodes glutathione transferase belonging to the phi class of GSTs. Naming convention according to Wagner et al. (2002).  The expression of this gene is upregulated by herbicide safeners such as benoxacor and fenclorim.","GLUTATHIONE S-TRANSFERASE PHI 2 (GSTF2)","AT4G02520.1","GSTF2",0.769,0.877,-0.0985,-0.0283,0.757,0.822,-0.18,0.123
"11","aGIkVFGHPASIATRR","AT4G02520.1","N-Term(Acetyl); K4(iTRAQ8plex)",0.99,2.15,1.25,1.14,1.06,1.01,1.03,0.79,0.94,0.84,0.97,0.85,0.7,0.21,0,0.65,0.21,0,"AT4G02520","Encodes glutathione transferase belonging to the phi class of GSTs. Naming convention according to Wagner et al. (2002).  The expression of this gene is upregulated by herbicide safeners such as benoxacor and fenclorim.","GLUTATHIONE S-TRANSFERASE PHI 2 (GSTF2)","AT4G02520.1","GSTF3",0.208,0.857,-0.728,-0.147,0.655,0.803,-0.294,-0.168
"13","akSVSTAASSLVQNLR","AT5G08060.1","N-Term(Acetyl); K2(iTRAQ8plex)",1.09,0.95,0.99,1,1.01,0.99,1.14,1.06,1.24,0.87,1,0.94,1.04,0.43,0,1,0.43,0,"AT5G08060","furry;(source:Araport11)","","AT5G08060.1","B14.5a",0.234,0.631,-0.829,-0.848,0.778,0.736,-0.163,-0.359
"14","akSVSTAASSLVQNLRR","AT5G08060.1","N-Term(Acetyl); K2(iTRAQ8plex)",1.06,1.23,0.99,1.01,1.06,0.94,0.98,1.12,0.92,0.92,0.95,1.02,0.95,0.49,0,0.89,0.49,0,"AT5G08060","furry;(source:Araport11)","","AT5G08060.1","B14.5a",0.234,0.631,-0.829,-0.848,0.778,0.736,-0.163,-0.359
"15","aLDTYASSNPNDVHEDVLLkAR","AT5G58005.2","N-Term(Acetyl); K20(iTRAQ8plex)",0.94,1.08,0.92,0.92,1.03,0.99,1.26,1.08,0.96,1.01,1.38,0.88,1.13,0.14,0,1.1,0.14,0,"AT5G58005","Cytochrome c oxidase, subunit Vib family protein;(source:Araport11)","","AT5G58005.2","Cytochrome c oxidase, subunit Vib family protein",0.583,0.873,0.48,-0.0757,0.834,0.827,-0.0214,-0.137
"18","aQkVEAGGGAGGASWDDGVHDGVR","AT3G16450.3","N-Term(Acetyl); K3(iTRAQ8plex)",0.32,1.6,1.42,0.9,0.41,2.31,0.76,1.07,0.66,1.34,0.93,1.39,1.07,0.89,0,1.02,0.89,0,"AT3G16450","Mannose-binding lectin superfamily protein;(source:Araport11)","JACALIN-RELATED LECTIN 33 (JAL33)","AT3G16450.3","JAL33",0.38,0.605,-0.914,-1.27,0.757,0.831,-0.284,-0.149
"25","aTLkVSDSVPAPSDDAEQLR","AT1G35720.1","N-Term(Acetyl); K4(iTRAQ8plex)",1.14,1,1.02,0.98,1,0.9,1.03,0.76,1.03,0.75,1.16,0.74,0.89,0.18,0,0.89,0.18,0,"AT1G35720","Encodes a member of the annexin gene family, a diverse, multigene family of calcium-dependent, membrane-binding proteins. The protein was determined to have peroxidase activity. This activity is thought to be dependent on the presence of post-translational modifications (most likely phosphorylation). The protein was shown to be present as a mixture of monomer and homodimer. The homodimerization seems to be dependent on the presence of Ca2+ or H2O2. The dimerization was prevented by the addition of DTT, &#946;-mercaptoethanol and TCEP. Annat1 mRNA is expressed in flowers, roots,leaves and stems and is most abundant in stems. mRNA levels are increased in response to oxidative stress.  Developmental expression patterns suggest a role in Golgi-mediated polysaccharide secretion. It is a Ca  2+-permeable transporter providing a molecular link between reactive oxygen species and cytosolic Ca 2+ in plants. The mRNA is cell-to-cell mobile.","ANNEXIN 1 (ANNAT1)","AT1G35720.1","ANN1",0.436,0.815,-0.552,-0.349,0.828,0.681,0.0345,-0.42
"30","aVSLLSkLR","AT5G44730.2","N-Term(Acetyl); K7(iTRAQ8plex)",1.02,1.07,1.06,1.08,0.98,1.09,0.95,1.05,0.97,0.93,0.87,0.89,0.96,0.29,0,0.86,0.29,0,"AT5G44730","Haloacid dehalogenase-like hydrolase (HAD) superfamily protein;(source:Araport11)","","AT5G44730.2","Haloacid dehalogenase-like hydrolase (HAD) superfamily protein",0.77,0.694,0.0409,-0.276,0.451,0.574,-0.207,-0.229
"32","gDSESFVGkN","AT1G08480.1","N-Term(Acetyl); K9(iTRAQ8plex)",1.15,1.19,1.28,1.14,0.87,0.94,1.24,0.34,1.02,0.98,0.86,0.84,0.71,0.16,0,0.78,0.16,0,"AT1G08480","Encodes subunit 6 of mitochondrial complex II (succinate dehydrogenase complex) and participates in the respiratory chain. It contributes to anchoring succinate dehydrogenase to the inner mitochondrial membrane. The mRNA is cell-to-cell mobile.","SUCCINATE DEHYDROGENASE 6 (SDH6)","AT1G08480.1","SDH6",0.791,0.847,-0.0276,-0.139,0.803,0.795,-0.0652,0.135
"37","mDPSMANNPELLQFLAQEkER","AT5G50810.1","N-Term(Acetyl); M1(Oxidation); K19(iTRAQ8plex)",0.78,1.19,1,1.13,0.92,1.1,1,1.1,0.78,1.08,0.9,1,1.01,0.96,0,0.92,0.96,0,"AT5G50810","Encodes a small zinc finger-like protein that is a component of the mitochondrial protein import apparatus.","TRANSLOCASE INNER MEMBRANE SUBUNIT 8 (TIM8)","AT5G50810.1","TIM8",0.48,0.315,-0.608,-1.61,0.827,0.842,-0.0457,-0.0712
"40","mDSPFkPDVVR","AT3G12800.1","N-Term(Acetyl); M1(Oxidation); K6(iTRAQ8plex)",1.06,1,1.01,1,0.96,1.07,1.04,1,0.94,1,0.95,0.98,1,0.91,0,0.95,0.91,0,"AT3G12800","short-chain dehydrogenase-reductase B;(source:Araport11)","SHORT-CHAIN DEHYDROGENASE-REDUCTASE B (SDRB)","AT3G12800.1","SDRB",0.285,0.772,-0.978,-0.681,0.835,0.855,0.0177,-0.00317
"41","mDSYSSPPMGGSGSSVSPEVmmESVkTQLAQAYAEELIETLR","AT1G61570.1","N-Term(Acetyl); M1(Oxidation); M21(Oxidation); M22(Oxidation); K26(iTRAQ8plex)",1,2.37,1.2,1.89,0.81,1.69,0.59,0.69,0.88,1,0.8,1.77,0.59,0.15,0,0.69,0.15,0,"AT1G61570","Encodes a putative small zinc finger-like protein (TIM13); nucleus-encoded gene whose product is found in the mitochondrial inner membrane space.","TRANSLOCASE OF THE INNER MITOCHONDRIAL MEMBRANE 13 (TIM13)","AT1G61570.1","TIM13",0.00153,0.0818,-0.6,-0.703,0.816,0.854,0.0244,-0.00259
"46","mEGTIkSPANYVPLTPISFLDR","AT1G20560.1","N-Term(Acetyl); M1(Oxidation); K6(iTRAQ8plex)",0.93,1,0.87,1.04,1.05,1.07,1.08,0.96,1,0.81,1.17,0.73,1.08,0.16,0,0.97,0.16,0,"AT1G20560","acyl activating enzyme 1;(source:Araport11)","ACYL ACTIVATING ENZYME 1 (AAE1)","AT1G20560.2","AAE1",0.773,0.869,-0.0639,-0.0583,0.783,0.804,0.0991,-0.127
"56","mmVDTSAGEkR","AT5G53140.2","N-Term(Acetyl); M1(Oxidation); M2(Oxidation); K10(iTRAQ8plex)",0.86,1.35,1.09,0.74,1.04,1.09,1.05,0.95,0.96,0.84,1.13,0.75,1.02,0.88,0,0.91,0.88,0,"AT5G53140","Protein phosphatase 2C family protein;(source:Araport11)","","AT5G53140.2","Probable protein phosphatase 2C 76",0.711,0.845,-0.217,-0.216,0.781,0.793,0.143,-0.206
"60","sGkVLSEEER","AT2G27730.4","N-Term(Acetyl); K3(iTRAQ8plex)",0.95,1.05,0.75,0.55,0.92,0.94,1.6,0.99,1.2,1.99,1.01,2.21,1.35,0.2,0,1.94,0.2,0,"AT2G27730","copper ion binding protein;(source:Araport11)","","AT2G27730.4","P2/16 kDa",0.772,0.811,0.22,-0.851,0.82,0.842,-0.136,-0.137
"62","skVGSSLYSR","AT3G13150.1","N-Term(Acetyl); K2(iTRAQ8plex)",0.88,1.12,0.83,0.83,0.84,1.31,1.03,1.01,0.82,1.18,1.08,0.99,1.14,0.31,0,1.11,0.31,0,"AT3G13150","Tetratricopeptide repeat (TPR)-like superfamily protein;(source:Araport11)","","AT3G13150.1","Pentatricopeptide repeat-containing protein At3g13150",0.122,0.732,0.482,0.301,0.174,0.203,0.377,0.513
"64","sSAVDATGNPIPTSAVLTASAkHIGMR","AT5G18800.2","N-Term(Acetyl); K22(iTRAQ8plex)",1.1,1.24,0.91,0.97,1.07,0.93,1.14,1.22,0.85,0.74,1.03,0.83,1.04,0.71,0,0.82,0.71,0,"AT5G18800","Cox19-like CHCH family protein;(source:Araport11)","","AT5G18800.2","PGIV.1",0.0245,0.728,-1.04,-0.489,0.825,0.832,-0.0363,-0.0785
"65","sSAVDATGNPIPTSAVLTASAkHIGMR","AT5G18800.2","N-Term(Acetyl); K22(iTRAQ8plex)",1.1,1.24,0.91,0.97,1.07,0.93,1.14,1.22,0.85,0.74,1.03,0.83,1.04,0.71,0,0.82,0.71,0,"AT5G18800","Cox19-like CHCH family protein;(source:Araport11)","","AT5G18800.2","PGIV",0.772,0.822,-0.0967,-0.333,0.828,0.837,-0.0363,-0.0785
"67","sSGkVLSEEER","AT2G27730.4","N-Term(Acetyl); K4(iTRAQ8plex)",0.63,0.86,1.01,0.83,1.24,0.94,1.08,1.19,1.06,1.21,0.99,0.97,1.33,0.04,0,1.27,0.04,0,"AT2G27730","copper ion binding protein;(source:Araport11)","","AT2G27730.4","P2/16 kDa",0.772,0.811,0.22,-0.851,0.82,0.842,-0.136,-0.137
"68","sSTEEmSSVkNTTQVIGVDPSSTVR","AT3G44320.1","N-Term(Acetyl); M6(Oxidation); K10(iTRAQ8plex)",0.96,1.11,1.12,0.84,0.78,1.04,0.98,0.86,1.16,0.89,1.2,1.02,0.91,0.32,0,1.06,0.32,0,"AT3G44320","This enzyme catalyzes the hydrolysis of indole-3-acetonitrile (IAN) to indole-3-acetic acid (IAA) (EC 3.5.5.1) and IAN to indole-3-acetamide (IAM) at lower levels.  It is the only one of the four Arabidopsis nitrilases whose mRNA levels are strongly induced when plants experience sulphur deprivation. This enzyme likely participates in other non-auxin-related metabolic pathways.","NITRILASE 3 (NIT3)","AT3G44320.1","NIT3",0.134,0.809,-1.01,-0.408,0.742,0.778,0.232,0.27
"71","sVSGGNGTAGkR","AT5G13420.1","N-Term(Acetyl); K11(iTRAQ8plex)",0.98,1.17,0.81,1.19,1.02,1.34,1.18,1.29,0.77,0.83,0.82,0.82,1.16,0.18,0,0.78,0.18,0,"AT5G13420","Aldolase-type TIM barrel family protein;(source:Araport11)","TRANSALDOLASE 2 (TRA2)","AT5G13420.1","Aldolase-type TIM barrel family protein",0.778,0.845,-0.117,-0.326,0.182,0.375,1.07,1.13
"72","tAAQGNSNETLFSSYkmGR","AT2G06050.2","N-Term(Acetyl); K16(iTRAQ8plex); M17(Oxidation)",1.19,1.03,0.98,1.15,0.78,0.88,1.02,1,1.13,0.97,0.8,1,0.85,0.07,0,0.9,0.07,0,"AT2G06050","Encodes a 12-oxophytodienoate reductase that is required for jasmonate biosynthesis. Mutants are male sterile and defective in pollen dehiscence. Shows activity towards 2,4,6-trinitrotoluene.  CFA-Ile, CFA-Leu, CFA-Val, CFA-Met and CFA-Ala can restore the fertility of opr3 plants by inducing filament elongation and anther dehiscence.","OXOPHYTODIENOATE-REDUCTASE 3 (OPR3)","AT2G06050.3","OPR3",0.585,0.853,-0.595,-0.267,0.545,0.749,-0.639,-0.461
"73","tDTkDAGmDAVQR","AT3G02780.1","N-Term(Acetyl); K4(iTRAQ8plex); M8(Oxidation)",0.83,1.49,1,0.89,1.02,0.98,1.06,1.04,1.11,0.77,1,0.94,0.97,0.85,0,0.91,0.85,0,"AT3G02780","Encodes a protein with isopentenyl diphosphate:dimethylallyl diphosphate isomerase activity. There is genetic evidence that it functions in the mevalonate, but not the MEP biosynthetic pathway.","ISOPENTENYL PYROPHOSPHATE:DIMETHYLALLYL PYROPHOSPHATE ISOMERASE 2 (IPP2)","AT3G02780.1","IPP2",0.481,0.857,-0.193,-0.0609,0.614,0.798,-0.139,-0.0758
"75","sGGGSYGGYGGSSGR","AT3G22310.1","N-Term(iTRAQ8plex)",0.15,0.02,0.16,0.11,0.94,1.19,0.98,1.1,1.06,1.19,1.02,1.19,9.48,0,1,10.07,0,1,"AT3G22310","Sequence similarity ot DEAD-box RNA helicases. Binds RNA and DNA. Involved in drought, salt and cold stress responses. The mRNA is cell-to-cell mobile.","PUTATIVE MITOCHONDRIAL RNA HELICASE 1 (PMH1)","AT3G22310.1","RH9",5.56e-11,0.0103,2.15,1.74,2.97e-14,5.04e-14,3.72,3.76
"78","aTSVSQNEGR","AT4G21020.1","N-Term(iTRAQ8plex)",0.26,0.22,0.2,0.18,1.32,1.25,1.81,1.09,0.75,1.26,1.08,0.92,6.31,0,1,4.63,0,1,"AT4G21020","Late embryogenesis abundant protein (LEA) family protein;(source:Araport11)","","AT4G21020.1","Late embryogenesis abundant protein (LEA) family protein",7.61e-08,0.0134,1.99,1.85,0.000809,0.0781,1.16,0.987
"79","tSVSQNEGRDPLDNAR","AT4G21020.1","N-Term(iTRAQ8plex)",0.34,0.19,0.29,0.26,1.64,1.04,1.81,1.11,0.96,1.6,1.07,0.93,5.13,0.01,1,4.17,0.01,1,"AT4G21020","Late embryogenesis abundant protein (LEA) family protein;(source:Araport11)","","AT4G21020.1","Late embryogenesis abundant protein (LEA) family protein",7.61e-08,0.0134,1.99,1.85,0.000809,0.0781,1.16,0.987
"80","gFAISESSER","AT3G22330.1","N-Term(iTRAQ8plex)",0.22,0.23,0.21,0.24,1.06,1.05,1.04,1.15,1.1,0.95,0.96,1.14,4.8,0,1,4.64,0,1,"AT3G22330","DEAD-box protein required for efficient group II  intron splicing in mitochondria.","PUTATIVE MITOCHONDRIAL RNA HELICASE 2 (PMH2)","AT3G22330.1","RH53",0.000553,0.204,1.54,1.41,9.17e-07,0.000834,1.77,1.73
"81","aFSSAEEAAAER","AT1G10270.1","N-Term(iTRAQ8plex)",0.3,0.16,0.27,0.19,1.08,0.94,1.07,0.98,1.06,1.17,1.6,1.02,4.45,0,1,5.33,0,1,"AT1G10270","glutamine-rich protein 23;(source:Araport11)","GLUTAMINE-RICH PROTEIN 23 (GRP23)","AT1G10270.1","GRP23",0.00621,0.255,1.39,1.41,1.67e-11,2.59e-06,2.48,2.4
"82","gFAISESSERR","AT3G22330.1","N-Term(iTRAQ8plex)",0.3,0.22,0.25,0.19,1.09,1.03,0.99,1.15,1.11,0.97,1.01,1.11,4.43,0,1,4.38,0,1,"AT3G22330","DEAD-box protein required for efficient group II  intron splicing in mitochondria.","PUTATIVE MITOCHONDRIAL RNA HELICASE 2 (PMH2)","AT3G22330.1","RH53",0.000553,0.204,1.54,1.41,9.17e-07,0.000834,1.77,1.73
"85","sQmLNFMDQVSEIPLVSATR","AT5G51440.1","N-Term(iTRAQ8plex); M3(Oxidation)",0.43,0.63,0.31,0.3,1.06,1.12,1.79,0.98,0.94,1.27,1.31,1.02,2.97,0.02,1,2.72,0.02,1,"AT5G51440","HSP20-like chaperones superfamily protein;(source:Araport11)","","AT5G51440.1","HSP23.5",0.265,0.656,0.974,0.993,0.00447,0.00799,1.74,2.23
"86","tSSEAASSAIQALDGR","AT5G61030.1","N-Term(iTRAQ8plex)",0.53,0.82,0.4,0.4,1.14,1.93,1.98,1.16,0.86,1.88,1.49,0.84,2.89,0.02,1,2.36,0.02,1,"AT5G61030","Encodes a glycine-rich RNA binding protein that is involved in C-> U RNA editing in mitochondria. Gene expression is induced by cold. The mRNA is cell-to-cell mobile.","RNA-BINDING GLYCINE-RICH PROTEIN A7 (RBGA7)","AT5G61030.2","RBG3",0.65,0.85,0.408,0.252,8.02e-05,0.0516,2.17,1.74
"88","sSLSAASAEAER","AT2G43360.1","N-Term(iTRAQ8plex)",0.55,0.44,0.49,0.46,1.56,1.33,1.1,1.16,0.94,1.06,0.99,1.01,2.66,0,1,2.06,0,0,"AT2G43360","Catalyzes the conversion of dethiobiotin to biotin.","BIOTIN AUXOTROPH 2 (BIO2)","AT2G43360.1","BIO2",3.46e-07,0.0244,2.2,2.03,1.57e-06,0.00332,1.8,1.64
"89","pLkSGSNFSDR","AT1G32580.1","N-Term(iTRAQ8plex); K3(iTRAQ8plex)",0.45,0.47,0.45,0.38,1.27,1.12,1.12,1.11,1.14,0.88,1.18,0.89,2.65,0,1,2.34,0,0,"AT1G32580","Member of MORF family consisting of of nine full-length proteins encoded in the nuclear genome. MORF proteins are required for all RNA editing events in plastids and for many, possibly also all, sites in mitochondria. Potential link between the RNA binding PPR protein and the protein contributing the enzymatic activity in RNA editing.","MULTIPLE ORGANELLAR RNA EDITING FACTOR 5 (MORF5)","AT1G32580.1","MORF5",0.235,0.617,1.93,2.05,0.299,0.542,1.56,1.48
"90","sRPVGNDVIGIDLGTTNScVSVmEGkTAR","AT4G37910.1","N-Term(iTRAQ8plex); C19(Carbamidomethyl); M23(Oxidation); K26(iTRAQ8plex)",0.38,0.18,0.73,0.55,1,1.4,1.38,1.04,1,1.08,0.98,1.02,2.62,0,1,2.21,0,0,"AT4G37910","mitochondrial heat shock protein 70-1;(source:Araport11)","MITOCHONDRIAL HEAT SHOCK PROTEIN 70-1 (mtHsc70-1)","AT4G37910.2","HSP70-9",5.47e-05,0.0135,0.565,0.669,3.1e-06,0.000559,0.546,0.572
"91","tmAFSSAEEAAAER","AT1G10270.1","N-Term(iTRAQ8plex); M2(Oxidation)",0.35,0.33,0.47,0.41,0.93,1.08,0.95,1.08,1.07,1.1,1.07,1.05,2.61,0,1,2.77,0,1,"AT1G10270","glutamine-rich protein 23;(source:Araport11)","GLUTAMINE-RICH PROTEIN 23 (GRP23)","AT1G10270.1","GRP23",0.00621,0.255,1.39,1.41,1.67e-11,2.59e-06,2.48,2.4
"93","iSVDALkPSDTFPR","AT2G26080.1","N-Term(iTRAQ8plex); K7(iTRAQ8plex)",0.2,1.4,0.23,1.41,0.6,3.6,0.59,2.88,0.3,2.28,0.52,1.98,2.38,0.26,0,1.57,0.26,0,"AT2G26080","glycine decarboxylase P-protein 2;(source:Araport11)","GLYCINE DECARBOXYLASE P-PROTEIN 2 (GLDP2)","AT2G26080.1","GLDP2",0.000596,0.274,0.605,0.503,0.000181,0.0816,0.558,0.432
"94","vSQAGFAISESSER","AT3G22330.1","N-Term(iTRAQ8plex)",0.44,0.32,0.59,0.58,1,1.14,1.15,1.18,1.08,1,1.03,0.97,2.32,0,1,2.12,0,0,"AT3G22330","DEAD-box protein required for efficient group II  intron splicing in mitochondria.","PUTATIVE MITOCHONDRIAL RNA HELICASE 2 (PMH2)","AT3G22330.1","RH53",0.000553,0.204,1.54,1.41,9.17e-07,0.000834,1.77,1.73
"97","aEAVEAADPATTR","AT4G30490.1","N-Term(iTRAQ8plex)",0.49,0.61,0.32,0.37,1.02,0.98,0.97,1.03,1.17,1.24,1.03,1.16,2.24,0,1,2.57,0,1,"AT4G30490","AFG1-like ATPase family protein;(source:Araport11)","","AT4G30490.1","AFG1-like ATPase family protein.2",0.803,0.839,0.00744,0.295,0.77,0.784,0.196,0.276
"98","sILVSGGSR","AT4G09730.1","N-Term(iTRAQ8plex)",0.63,0.53,0.42,0.35,1.12,1.13,0.96,1.1,0.97,1.03,1.6,1.04,2.24,0,1,2.41,0,1,"AT4G09730","Encodes RH39, a DEAD-box protein involved in the introduction of the hidden break into the 23S rRNA in the chloroplasts. Recombinant RH39 binds to the 23S rRNA in a segment adjacent to the stem-loop creating the hidden break target loop in a sequence-dependent manner. Has ATP-hydrolyzing activity at a Kcat of 5.3 /min in the presence of rRNA sequence. Mutants have drastically reduced level of level of ribulose 1,5-bisphosphate carboxylase/oxygenase. The mRNA is cell-to-cell mobile.","RH39 (RH39)","AT4G09730.1","RH39",0.631,0.81,0.313,0.337,1.4e-05,0.00421,1.66,1.62
"100","sGGGGYGGSSGGYGGGR","AT3G22330.1","N-Term(iTRAQ8plex)",0.53,0.38,0.65,0.51,0.91,1.14,0.87,1.22,1.09,1.17,1.13,1.31,2,0,0,2.26,0,0,"AT3G22330","DEAD-box protein required for efficient group II  intron splicing in mitochondria.","PUTATIVE MITOCHONDRIAL RNA HELICASE 2 (PMH2)","AT3G22330.1","RH53",0.000553,0.204,1.54,1.41,9.17e-07,0.000834,1.77,1.73
"101","fHSLSLTDTR","AT3G51010.1","N-Term(iTRAQ8plex)",0.78,0.97,0.46,0.46,1.03,1.98,0.62,1.65,0.7,2.09,1.38,2.28,1.99,0.12,0,2.43,0.12,0,"AT3G51010","protein translocase subunit;(source:Araport11)","","AT3G51010.1"," protein translocase subunit ",0.785,0.816,-0.112,-0.646,0.0292,0.844,1.99,0.0934
"102","vSEIPLVSATR","AT5G51440.1","N-Term(iTRAQ8plex)",0.53,0.83,0.44,0.49,1.1,1.04,1.4,0.97,0.96,1.43,1.35,1.03,1.98,0,0,2.08,0,0,"AT5G51440","HSP20-like chaperones superfamily protein;(source:Araport11)","","AT5G51440.1","HSP23.5",0.265,0.656,0.974,0.993,0.00447,0.00799,1.74,2.23
"104","sYDDRLETLSHVR","AT2G43360.1","N-Term(iTRAQ8plex)",0.61,0.72,0.51,0.61,1.29,1.08,1.03,1.31,0.92,1.13,0.97,1.17,1.92,0,0,1.71,0,0,"AT2G43360","Catalyzes the conversion of dethiobiotin to biotin.","BIOTIN AUXOTROPH 2 (BIO2)","AT2G43360.1","BIO2",3.46e-07,0.0244,2.2,2.03,1.57e-06,0.00332,1.8,1.64
"105","sQSDGFSGGR","AT1G31817.1","N-Term(iTRAQ8plex)",0.55,0.48,0.61,0.54,1.03,0.97,0.96,1.15,1.1,1.07,1.04,1.09,1.88,0,0,1.97,0,0,"AT1G31817","Ribosomal L18p/L5e family protein;(source:Araport11)","NUCLEAR FUSION DEFECTIVE 3 (NFD3)","AT1G31817.1","NFD3",0.00261,0.402,1.01,0.767,0.107,0.386,0.539,0.482
"106","sAEAVEAADPATTR","AT4G30490.1","N-Term(iTRAQ8plex)",0.53,0.51,0.6,0.51,1.05,0.95,0.86,1.17,1.33,1.14,1.14,1.2,1.88,0,0,2.24,0,0,"AT4G30490","AFG1-like ATPase family protein;(source:Araport11)","","AT4G30490.1","AFG1-like ATPase family protein.2",0.803,0.839,0.00744,0.295,0.77,0.784,0.196,0.276
"108","sPEGYGSDR","AT3G22330.1","N-Term(iTRAQ8plex)",0.53,0.42,0.72,0.56,0.91,1.09,0.9,1.1,1.15,1.16,2.25,1.28,1.8,0,0,2.63,0,1,"AT3G22330","DEAD-box protein required for efficient group II  intron splicing in mitochondria.","PUTATIVE MITOCHONDRIAL RNA HELICASE 2 (PMH2)","AT3G22330.1","RH53",0.000553,0.204,1.54,1.41,9.17e-07,0.000834,1.77,1.73
"109","sIPTIMDIYNLQDVVAPSQLR","AT3G12260.1","N-Term(iTRAQ8plex)",0.55,0.68,0.6,0.47,0.94,1.06,1.08,0.92,1.18,1.36,1.48,1.45,1.75,0,0,2.39,0,1,"AT3G12260","LYR family of Fe/S cluster biogenesis protein;(source:Araport11)","","AT3G12260.1","B14",4.74e-14,7.79e-14,3.6,3.81,0.294,0.601,0.424,0.357
"110","sQAGFAISESSER","AT3G22330.1","N-Term(iTRAQ8plex)",0.69,0.77,0.52,0.5,1.11,1.09,0.97,1.17,1.04,0.96,1.03,1.28,1.75,0,0,1.74,0,0,"AT3G22330","DEAD-box protein required for efficient group II  intron splicing in mitochondria.","PUTATIVE MITOCHONDRIAL RNA HELICASE 2 (PMH2)","AT3G22330.1","RH53",0.000553,0.204,1.54,1.41,9.17e-07,0.000834,1.77,1.73
"111","aGFAISESSERR","AT3G22330.1","N-Term(iTRAQ8plex)",0.68,0.51,0.69,0.58,0.96,1.26,1.03,1.03,1.04,1.05,0.97,1.19,1.75,0,0,1.73,0,0,"AT3G22330","DEAD-box protein required for efficient group II  intron splicing in mitochondria.","PUTATIVE MITOCHONDRIAL RNA HELICASE 2 (PMH2)","AT3G22330.1","RH53",0.000553,0.204,1.54,1.41,9.17e-07,0.000834,1.77,1.73
"112","sGkVLSEEER","AT2G27730.4","N-Term(iTRAQ8plex); K3(iTRAQ8plex)",0.69,0.74,0.44,0.48,0.97,1.03,1.07,0.93,1.28,1.41,1.14,1.08,1.7,0.01,0,2.09,0.01,0,"AT2G27730","copper ion binding protein;(source:Araport11)","","AT2G27730.4","P2/16 kDa",0.772,0.811,0.22,-0.851,0.82,0.842,-0.136,-0.137
"114","aTNANEDPNQNR","AT1G07210.1","N-Term(iTRAQ8plex)",0.7,0.72,0.69,0.58,1.2,1.08,1.09,1.19,0.92,1.16,0.96,1.04,1.69,0,0,1.51,0,0,"AT1G07210","Ribosomal protein S18;(source:Araport11)","","AT1G07210.1","Ribosomal protein S18",0.0343,0.786,1.08,0.401,0.23,0.468,0.605,0.594
"115","ySSLSAASAEAER","AT2G43360.1","N-Term(iTRAQ8plex)",0.56,0.48,0.98,0.69,0.95,1.08,1.33,1.2,1.11,1.05,1.02,0.89,1.69,0.02,0,1.51,0.02,0,"AT2G43360","Catalyzes the conversion of dethiobiotin to biotin.","BIOTIN AUXOTROPH 2 (BIO2)","AT2G43360.1","BIO2",3.46e-07,0.0244,2.2,2.03,1.57e-06,0.00332,1.8,1.64
"117","aGNAPDVSLDNSVTDEQVR","AT4G16580.1","N-Term(iTRAQ8plex)",0.63,0.7,0.57,0.57,0.87,1.13,1.18,0.88,1.24,1.31,1.12,1.19,1.64,0.01,0,1.97,0.01,0,"AT4G16580","Protein phosphatase 2C family protein;(source:Araport11)","","AT4G16580.1","Probable protein phosphatase 2C 55",0.722,0.859,0.181,0.134,0.564,0.568,-0.37,-0.506
"119","aGFAISESSER","AT3G22330.1","N-Term(iTRAQ8plex)",0.73,0.67,0.81,0.59,0.95,1.34,1.01,1.25,1.05,1.24,0.99,1.16,1.63,0.01,0,1.58,0.01,0,"AT3G22330","DEAD-box protein required for efficient group II  intron splicing in mitochondria.","PUTATIVE MITOCHONDRIAL RNA HELICASE 2 (PMH2)","AT3G22330.1","RH53",0.000553,0.204,1.54,1.41,9.17e-07,0.000834,1.77,1.73
"120","sEQGGGGGGGDDFPVPVTR","AT1G33360.1","N-Term(iTRAQ8plex)",0.71,0.66,0.72,0.6,1.1,0.92,0.99,1.33,1.17,1.08,1.14,1.01,1.61,0.02,0,1.64,0.02,0,"AT1G33360","Encodes ClpX3, a subunit of the Clp protease complex.","","AT1G33360.1","ATP-dependent Clp protease",0.303,0.515,-0.573,-0.855,0.764,0.836,-0.148,-0.0695
"121","sSNQSPNQmNEVAPPPSVEEVMR","AT2G15690.1","N-Term(iTRAQ8plex); M9(Oxidation)",0.63,0.62,0.92,0.8,1.02,1.02,1.17,1.4,0.98,1.06,0.96,1.04,1.55,0.01,0,1.36,0.01,0,"AT2G15690","Encodes an atypical PPR-DYW protein containing five predicted PPR domains and a C-terminal DYW domain separated by an amino acid sequence that do not clearly correspond to an E domain.  It is expressed in both the mitochondrion and chloroplast and is also involved in RNA editing in the mitochondrion and chloroplast as a core member of E+-type PPR editosomes.","DYW DOMAIN PROTEIN 2 (DYW2)","AT2G15690.1","PCMP-H66",0.611,0.418,0.437,1.39,0.822,0.814,0.0622,-0.184
"122","sFATQEEAAAER","AT3G49240.1","N-Term(iTRAQ8plex)",0.71,0.55,0.72,0.61,0.97,1.03,0.88,1.12,1.14,1.12,1.21,1.17,1.55,0,0,1.79,0,0,"AT3G49240","Encodes NUWA, an imprinted gene that controls mitochondrial function in early seed development.  It is expressed in both the mitochondrion and chloroplast and is also involved in RNA editing in the mitochondrion and chloroplast as a core member of E+-type PPR editosomes.","NUWA (NUWA)","AT3G49240.1","EMB1796",0.0223,0.3,0.696,0.75,0.8,0.331,-0.0574,0.45
"123","sLSQMLNFmDQVSEIPLVSATR","AT5G51440.1","N-Term(iTRAQ8plex); M9(Oxidation)",0.75,1.04,0.46,0.46,0.96,1.14,1.27,0.81,0.9,1.12,1.26,1.19,1.54,0.08,0,1.65,0.08,0,"AT5G51440","HSP20-like chaperones superfamily protein;(source:Araport11)","","AT5G51440.1","HSP23.5",0.265,0.656,0.974,0.993,0.00447,0.00799,1.74,2.23
"127","akDISFGIGAR","AT3G13860.1","N-Term(iTRAQ8plex); K2(iTRAQ8plex)",0.58,0.59,0.75,0.74,1.08,0.92,1.02,0.98,1.26,1.12,1.11,1.1,1.51,0,0,1.73,0,0,"AT3G13860","heat shock protein 60-3A;(source:Araport11)","HEAT SHOCK PROTEIN 60-3A (HSP60-3A)","AT3G13860.1","HSP60-3A",0.781,0.863,-0.0203,0.0352,0.348,0.371,-0.168,-0.224
"128","sSQSDGFSGGR","AT1G31817.1","N-Term(iTRAQ8plex)",0.7,0.61,0.8,0.88,1.02,0.98,0.9,1.45,1.3,1.24,1.1,1.38,1.45,0.06,0,1.68,0.06,0,"AT1G31817","Ribosomal L18p/L5e family protein;(source:Araport11)","NUCLEAR FUSION DEFECTIVE 3 (NFD3)","AT1G31817.1","NFD3",0.00261,0.402,1.01,0.767,0.107,0.386,0.539,0.482
"129","aTDAVVESDYkR","AT5G67590.1","N-Term(iTRAQ8plex); K11(iTRAQ8plex)",0.57,1.03,0.57,1.26,0.84,0.97,0.71,2.45,1.22,1.15,0.74,1.65,1.45,0.43,0,1.39,0.43,0,"AT5G67590","Mutant leaves have a reduced capacity for cold acclimation, appear water-soaked, leak electrolytes, and accumulate reactive oxygen species constitutively. Encode a protein with high similarity to the 18-kD Fe-S subunit of complex I (NADH dehydrogenase, EC 1.6.5.3) in the mitochondrial electron transfer chain. The mRNA is cell-to-cell mobile.","FROSTBITE1 (FRO1)","AT5G67590.1","18 kDa",0.748,0.86,-0.219,-0.209,0.395,0.533,0.797,0.874
"130","aTDAVVESDYkRGEIGkVSGIPEEHLSR","AT5G67590.1","N-Term(iTRAQ8plex); K11(iTRAQ8plex); K17(iTRAQ8plex)",1,1,0.3,1.36,1.49,0.96,0.64,2.2,1.36,0.97,0.3,1.56,1.45,0.36,0,1.15,0.36,0,"AT5G67590","Mutant leaves have a reduced capacity for cold acclimation, appear water-soaked, leak electrolytes, and accumulate reactive oxygen species constitutively. Encode a protein with high similarity to the 18-kD Fe-S subunit of complex I (NADH dehydrogenase, EC 1.6.5.3) in the mitochondrial electron transfer chain. The mRNA is cell-to-cell mobile.","FROSTBITE1 (FRO1)","AT5G67590.1","18 kDa",0.748,0.86,-0.219,-0.209,0.395,0.533,0.797,0.874
