"","Sequence","prot_acc","Modifications","col-0.1","col-0.2","col-0.3","col-0.4","clp1.1","clp1.2","clp1.3","clp1.4","clp2.1","clp2.2","clp2.3","clp2.4","clp1/col-0 Ratio","clp1/col-0 TTEST","clp1/col-0 REGULATION","clp2/col-0 Ratio","clp2/col-0 TTEST","clp2/col-0 REGULATION","gene","Gene Model Name","Gene Model Type","ID","name","clp1p__vs_wtp__p.adj","clp2p__vs_wtp__p.adj","clp1p__vs_wtp__ratio","clp2p__vs_wtp__ratio","clp1s__vs_wts__p.adj","clp2s__vs_wts__p.adj","clp1s__vs_wts__ratio","clp2s__vs_wts__ratio"
"248","fASSGGSDR","AT5G14590.1","N-Term(iTRAQ8plex)",1.03,1.09,0.98,0.89,0.84,1.17,1.06,1.08,0.97,0.95,1.02,0.68,1.04,0.63,0,0.91,0.63,0,"AT5G14590","Isocitrate/isopropylmalate dehydrogenase family protein;(source:Araport11)","","AT5G14590.1","T15N1_80",0.673,0.786,-0.167,-0.264,0.0162,0.266,-0.679,-0.541
"249","aGASQLmNEPLNDQR","AT5G66120.2","N-Term(iTRAQ8plex); M7(Oxidation)",0.99,1.01,0.95,1.07,0.68,1.26,1.28,0.98,0.9,1.32,1.02,0.92,1.04,0.78,0,1.04,0.78,0,"AT5G66120","3-dehydroquinate synthase;(source:Araport11)","","AT5G66120.2","DHQS",0.681,0.432,-0.169,-0.716,0.788,0.519,-0.0824,-0.382
"251","aSQLMNEPLNDQR","AT5G66120.2","N-Term(iTRAQ8plex)",0.96,1.03,0.82,1.08,1.01,1,1.02,1.03,0.81,1,0.98,0.69,1.04,0.52,0,0.89,0.52,0,"AT5G66120","3-dehydroquinate synthase;(source:Araport11)","","AT5G66120.2","DHQS",0.681,0.432,-0.169,-0.716,0.788,0.519,-0.0824,-0.382
"253","gGDHGHGAEGGDFR","AT4G00585.1","N-Term(iTRAQ8plex)",0.96,1.01,1.01,0.82,1.01,0.99,1.08,0.87,0.92,1.34,0.99,1.03,1.04,0.56,0,1.13,0.56,0,"AT4G00585","transmembrane protein;(source:Araport11)","","AT4G00585.1","NDU10/KFYI",0.0334,0.512,-0.975,-0.82,0.766,0.806,-0.139,-0.141
"257","sQSTHNIQVR","AT5G52920.1","N-Term(iTRAQ8plex)",1.06,1.06,0.99,1.09,0.83,1.31,1.01,1.21,0.78,0.94,0.96,0.87,1.04,0.75,0,0.85,0.75,0,"AT5G52920","encodes a dominant chloroplast pyruvate kinase beta subunit. Important for seed oil biosynthesis. Ubiquitously expressed, with significantly increased expression in maturing seeds. The mutant plant has wrinkled seeds, with a 50-70% reduction in seed fatty acid content. The mRNA is cell-to-cell mobile.","PLASTIDIC PYRUVATE KINASE BETA SUBUNIT 1 (PKP-BETA1)","AT5G52920.1","PKP2",0.657,0.649,-0.211,-0.521,0.438,0.383,-0.354,-0.523
"258","aSASTTVGSEQR","AT2G17630.1","N-Term(iTRAQ8plex)",1.03,1.1,0.98,1.16,0.97,1.18,1.02,1.24,0.76,0.92,0.88,0.75,1.04,0.62,0,0.78,0.62,0,"AT2G17630","Pyridoxal phosphate (PLP)-dependent transferases superfamily protein;(source:Araport11)","PHOSPHOSERINE AMINOTRANSFERASE 2 (PSAT2)","AT2G17630.1","PSAT2",0.749,0.482,0.0922,-0.669,0.458,0.433,-0.312,-0.437
"262","sLLPLYADIGDSDNVR","AT3G15590.1","N-Term(iTRAQ8plex)",1.02,0.98,1.07,0.93,0.81,1.29,0.99,1.04,1.05,0.97,1.01,0.99,1.03,0.78,0,1,0.78,0,"AT3G15590","Tetratricopeptide repeat (TPR)-like superfamily protein;(source:Araport11)","","AT3G15590.2","Pentatricopeptide repeat-containing protein At3g15590, mitochondrial",0.293,0.864,0.997,-0.171,0.719,0.806,0.355,0.257
"263","sGVSTAAYFAR","AT4G34700.1","N-Term(iTRAQ8plex)",0.96,1.15,0.95,0.77,0.87,1.03,1.16,0.9,0.97,1.12,1.3,1.05,1.03,0.78,0,1.16,0.78,0,"AT4G34700","Encodes the B22 subunit of eukaryotic mitochondrial Complex I. Mutation in the gene display pleiotropic phenotypes including shorter roots, smaller plants and delayed flowering. The mRNA is cell-to-cell mobile.","B22 SUBUNIT OF EUKARYOTIC MITOCHONDRIAL COMPLEX I (CIB22)","AT4G34700.1","B22",0.0601,0.787,-0.8,-0.321,0.781,0.802,-0.105,-0.135
"268","aAQTTAPAESTASVDADRLEPR","AT2G15620.1","N-Term(iTRAQ8plex)",0.98,1.43,0.86,1.14,1.02,1.19,1.19,1.11,0.72,0.87,0.82,0.89,1.02,0.86,0,0.75,0.86,0,"AT2G15620","Involved in the second step of nitrate assimilation.  Its expression is induced by nitrate. The mRNA is cell-to-cell mobile.","NITRITE REDUCTASE 1 (NIR1)","AT2G15620.1","NIR1",0.768,0.561,-0.0848,-0.751,0.0176,0.666,0.916,0.355
"269","sAHITAAPHGSLkGNLTIVDER","AT3G58750.1","N-Term(iTRAQ8plex); K13(iTRAQ8plex)",0.86,1.14,0.98,1.03,0.86,1.34,0.86,1.02,0.73,1.25,0.85,1.21,1.02,0.87,0,1.01,0.87,0,"AT3G58750","Encodes a peroxisomal citrate synthase that is expressed throughout seedling and shoot development.","CITRATE SYNTHASE 2 (CSY2)","AT3G58750.1","CSY2",0.59,0.813,-0.672,0.608,0.81,0.831,0.14,0.168
"271","sFSSGSVPER","AT1G53240.1","N-Term(iTRAQ8plex)",0.98,0.88,0.88,0.96,0.75,1.02,0.94,1.04,1.03,1.73,1.39,1.3,1.02,0.8,0,1.48,0.8,0,"AT1G53240","mMDH1 encodes a mitochrondrial malate dehydrogenase. It is expressed at higher levels than the other mitochrondrial isoform mMDH2 (At3G15020) according to transcript and proteomic analyses.","MITOCHONDRIAL MALATE DEHYDROGENASE 1 (mMDH1)","AT1G53240.1","mMDH1",0.661,0.854,-0.117,0.0682,0.78,0.827,-0.0575,0.0435
"272","aSTTVGSEQR","AT2G17630.1","N-Term(iTRAQ8plex)",1.01,1.17,0.89,1.24,1.17,0.95,1.09,1.18,0.76,0.99,0.91,0.75,1.02,0.83,0,0.79,0.83,0,"AT2G17630","Pyridoxal phosphate (PLP)-dependent transferases superfamily protein;(source:Araport11)","PHOSPHOSERINE AMINOTRANSFERASE 2 (PSAT2)","AT2G17630.1","PSAT2",0.749,0.482,0.0922,-0.669,0.458,0.433,-0.312,-0.437
"278","sPIPNTPSFNQSLVPLGFLNQAPAPR","AT1G26460.1","N-Term(iTRAQ8plex)",0.92,0.82,1.01,0.67,0.95,1.12,0.42,0.99,1.05,1.22,1.45,1.11,1.02,0.94,0,1.41,0.94,0,"AT1G26460","Tetratricopeptide repeat (TPR)-like superfamily protein;(source:Araport11)","","AT1G26460.1","Pentatricopeptide repeat-containing protein At1g26460, mitochondrial",0.00624,0.144,0.492,0.58,0.486,0.335,0.159,0.276
"281","yHENVIDHYDNPR","AT4G22220.1","N-Term(iTRAQ8plex)",0.69,1.35,0.85,1.12,0.66,1.31,0.63,1.46,0.32,3.51,0.88,2.25,1.02,0.95,0,1.74,0.95,0,"AT4G22220","Encodes a mitochondrial protein similar to E.coli IscU.  In bacteria, IscU is a scaffold protein accepting sulfur and iron to build a transient Fe-S cluster,which is subsequently transferred to a target apoprotein.","(ISU1)","AT4G22220.1","ISU1",0.704,0.73,0.121,0.309,0.805,0.846,-0.0497,-0.0216
"288","gVGTHDAYGcGFPNVHSR","AT1G54010.1","N-Term(iTRAQ8plex); C10(Carbamidomethyl)",0.94,1.27,1.43,0.65,1.55,1,0.84,0.95,0.97,1,3.86,1.05,1.01,0.96,0,1.6,0.96,0,"AT1G54010","GDSL-motif  esterase/acyltransferase/lipase. Enzyme group with broad substrate specificity that may catalyze acyltransfer or hydrolase reactions with lipid and non-lipid substrates.","GDSL-LIKE LIPASE 23 (GLL23)","AT1G54010.1","GLL23",0.0615,0.505,-1.87,-1.76,0.805,0.703,-0.163,-0.66
"290","vSTDSSPITIETAVPFTSHLcESPSR","AT1G24180.1","N-Term(iTRAQ8plex); C21(Carbamidomethyl)",0.93,1.27,1.01,1.15,1.07,1.16,0.99,1.17,0.62,0.85,0.95,0.9,1.01,0.92,0,0.76,0.92,0,"AT1G24180","Arabidopsis thaliana pyruvate dehydrogenase E1a-like subunit. 81% identical to a previously characterized Arabidopsis mitochondrial PDH E1a-subunit, At1g59900. Serine 296 phosphorylation of IAR4 has critical function in root hair formation and root development. Changing Ser296 in IAR4 to Ala resulted in a phenotype intermediate between mutant and wild-type, while substitution to Asp was either lethal or caused an extreme dwarf phenotype.","IAA-CONJUGATE-RESISTANT 4 (IAR4)","AT1G24180.1","IAR4",0.281,0.541,-0.208,-0.285,0.00399,0.0285,-0.387,-0.431
"291","sLNDTYYVDSQTVLR","AT3G58140.1","N-Term(iTRAQ8plex)",0.99,0.89,0.96,1.04,0.92,1.03,0.96,0.99,1.01,1.2,1.01,1.17,1.01,0.85,0,1.13,0.85,0,"AT3G58140","phenylalanyl-tRNA synthetase class IIc family protein;(source:Araport11)","","AT3G58140.1","Phenylalanine--tRNA ligase, chloroplastic/mitochondrial",0.792,0.874,-0.0162,-0.0214,0.311,0.787,0.245,0.0901
"292","gGGDHGHGAEGGDFR","AT4G00585.1","N-Term(iTRAQ8plex)",0.81,1.01,1.01,0.95,0.87,0.99,1.08,0.86,1.03,1.02,1.39,0.99,1.01,0.93,0,1.17,0.93,0,"AT4G00585","transmembrane protein;(source:Araport11)","","AT4G00585.1","NDU10/KFYI",0.0334,0.512,-0.975,-0.82,0.766,0.806,-0.139,-0.141
"298","sSIkQIASGR","AT5G53460.3","N-Term(iTRAQ8plex); K4(iTRAQ8plex)",1.3,0.89,0.95,1.29,0.98,1.15,0.95,1.34,0.76,1.02,0.93,1.05,1,0.99,0,0.85,0.99,0,"AT5G53460","NADH-dependent glutamate synthase The mRNA is cell-to-cell mobile.","NADH-DEPENDENT GLUTAMATE SYNTHASE 1 (GLT1)","AT5G53460.3","GLT1",0.79,0.466,0.0331,-0.814,0.635,0.699,0.256,-0.293
"302","aVDIGGVAIAR","AT3G58140.1","N-Term(iTRAQ8plex)",1.02,1.1,0.96,1.14,0.98,1.02,1.04,1.15,0.73,0.84,0.87,0.78,0.99,0.89,0,0.76,0.89,0,"AT3G58140","phenylalanyl-tRNA synthetase class IIc family protein;(source:Araport11)","","AT3G58140.1","Phenylalanine--tRNA ligase, chloroplastic/mitochondrial",0.792,0.874,-0.0162,-0.0214,0.311,0.787,0.245,0.0901
"308","vDIGGVAIAR","AT3G58140.1","N-Term(iTRAQ8plex)",1.02,1.17,0.99,1.01,0.98,1.05,1.06,1.03,0.78,0.93,0.89,0.74,0.98,0.69,0,0.8,0.69,0,"AT3G58140","phenylalanyl-tRNA synthetase class IIc family protein;(source:Araport11)","","AT3G58140.1","Phenylalanine--tRNA ligase, chloroplastic/mitochondrial",0.792,0.874,-0.0162,-0.0214,0.311,0.787,0.245,0.0901
"311","aVHQDVDGR","AT3G58610.2","N-Term(iTRAQ8plex)",1.12,1.22,1.09,0.85,0.79,1.04,1.47,0.91,0.66,0.96,1.93,0.82,0.98,0.9,0,1.02,0.9,0,"AT3G58610","ketol-acid reductoisomerase;(source:Araport11)","","AT3G58610.3","Ketol-acid reductoisomerase, chloroplastic",0.648,0.484,-0.237,-0.792,0.783,0.851,-0.106,-0.0166
"312","sSGFDQR","AT5G63380.1","N-Term(iTRAQ8plex)",1.09,0.93,0.99,1.01,0.87,1.07,0.87,1.12,0.92,1.31,0.96,1.2,0.98,0.78,0,1.09,0.78,0,"AT5G63380","Encodes a peroxisomal protein involved in the activation of fatty acids through esterification with CoA. At5g63380 preferentially activates fatty acids with increased chain length (C9:0 to C8:0) and thus shares characteristics with long-chain fatty acyl-CoA synthases. Also able to catalyze the conversion of OPDA to its CoA ester and is therefore thought to be involved in the peroxisomal &#946;-oxidation steps of jasmonic acid biosynthesis.","","AT5G63380.1","4CLL9",0.802,0.764,-0.0114,-0.577,0.821,0.426,0.0629,-0.796
"313","gYGEELGASDSVAVGTADHNR","AT3G09260.1","N-Term(iTRAQ8plex)",1.27,1.03,1,1,1.42,0.91,0.89,1,0.97,0.79,1.63,0.64,0.98,0.87,0,0.93,0.87,0,"AT3G09260","Encodes beta-glucosidase.The major constituent of ER bodies. One of the most abundant proteins in Arabidopsis seedlings. Exist in an soluble (inactive) and non-soluble (active) form, most probably formed in a polymerization process. Involved in the mutualistic interaction between Arabidopsis and the endophytic fungus Piriformospora indica.","(PYK10)","AT3G09260.1","BGLU23",0.286,0.394,-2.18,-3.78,0.836,0.853,0.0362,-0.0435
"314","aQSAPVPR","AT3G55410.2","N-Term(iTRAQ8plex)",1.07,1.06,1.03,1,1.01,0.99,1.07,1,0.99,0.87,0.93,0.89,0.98,0.35,0,0.88,0.35,0,"AT3G55410","2-oxoglutarate dehydrogenase, E1 component;(source:Araport11)","","AT3G55410.2","2-oxoglutarate dehydrogenase, E1 component",0.788,0.811,0.0155,-0.107,0.358,0.553,-0.168,-0.17
"315","dNLDYAAR","AT4G05180.2","N-Term(iTRAQ8plex)",1.05,1.4,1.06,1.14,1.56,0.95,1.1,0.94,0.46,0.57,0.62,0.59,0.98,0.88,0,0.48,0.88,0,"AT4G05180","Encodes the PsbQ subunit of the oxygen evolving complex of photosystem II.","PHOTOSYSTEM II SUBUNIT Q-2 (PSBQ-2)","AT4G05180.2","PSBQ2",0.597,0.87,0.282,-0.0595,0.816,0.371,-0.0492,-0.569
"316","gSSTGDLVTR","AT3G06810.1","N-Term(iTRAQ8plex)",1.03,1,1.02,0.99,1,0.96,0.96,1.01,0.97,1.02,1.02,0.91,0.98,0.17,0,0.97,0.17,0,"AT3G06810","Encodes a protein with similarity to acyl-CoA dehydrogenases. Mutations in IBR3 render   plants resistant to indole-3-butryic acid, a putative storage form of the biologically active auxin IAA  (indole-3-acetic acid). IBR3 is hypothesized to carry out the second step in a  &#946;-oxidation-like process of IBA metabolism in Arabidopsis.  Though its subcellular location has not been determined, IBR3 has a peroxisomal targeting  sequence and  two other putative IBA metabolic enzymes (IBR1 and IBR10)  can be found in this organelle. No specific enzymatic activity has been  documented for IBR3, but double mutant analyses with CHY1 argue against a role for IBR3 in general fatty  acid &#946;-oxidation. The mRNA is cell-to-cell mobile.","IBA-RESPONSE 3 (IBR3)","AT3G06810.1","IBR3",0.793,0.797,0.0369,-0.414,0.831,0.853,0.0254,-0.0115
"317","sSIcYIDGDEGILR","AT3G58750.1","N-Term(iTRAQ8plex); C4(Carbamidomethyl)",0.97,1.03,0.98,1.02,0.84,1.04,0.97,1.05,0.94,1.24,1.08,0.92,0.97,0.65,0,1.05,0.65,0,"AT3G58750","Encodes a peroxisomal citrate synthase that is expressed throughout seedling and shoot development.","CITRATE SYNTHASE 2 (CSY2)","AT3G58750.1","CSY2",0.59,0.813,-0.672,0.608,0.81,0.831,0.14,0.168
"319","sSGSDLPPHQEIGMPSLSPTmTEGNIAR","AT1G54220.1","N-Term(iTRAQ8plex); M21(Oxidation)",0.96,1.19,1.08,1.05,1.11,0.98,0.9,1.16,1.02,0.95,0.95,0.75,0.97,0.71,0,0.86,0.71,0,"AT1G54220","Encodes a subunit of the mitochondrial pyruvate dehydrogenase complex.","MITOCHONDRIAL PYRUVATE DEHYDROGENASE SUBUNIT 2-3 (MTE2-3)","AT1G54220.2","Dihydrolipoyllysine-residue acetyltransferase component 3 of pyruvate dehydrogenase complex, mitochondrial",0.721,0.749,-0.0692,-0.186,0.182,0.197,-0.247,-0.344
"323","lQSDNSTVNR","AT5G35630.1","N-Term(iTRAQ8plex)",0.96,1.07,1.12,1.12,0.93,1.38,0.77,1.03,0.61,1.04,0.97,0.89,0.97,0.81,0,0.82,0.81,0,"AT5G35630","chloroplastic glutamine synthetase The mRNA is cell-to-cell mobile.","GLUTAMINE SYNTHETASE 2 (GS2)","AT5G35630.3","GLN2",0.788,0.616,-0.0527,-0.832,0.694,0.722,0.284,-0.363
"324","sVVAkEcR","AT1G74030.1","N-Term(iTRAQ8plex); K5(iTRAQ8plex); C7(Carbamidomethyl)",1.14,1.18,0.83,1.03,1.05,0.95,1,1.04,0.73,0.91,1,0.78,0.97,0.69,0,0.82,0.69,0,"AT1G74030","Encodes the plastid-localized phosphoenolpyruvate enolase. Mutant plants have abnormal trichomes.","ENOLASE 1 (ENO1)","AT1G74030.1","ENO1",0.741,0.41,-0.0892,-0.641,0.171,0.781,-0.402,-0.129
"330","aPDTVAVWSDADDQR","AT2G42490.1","N-Term(iTRAQ8plex)",1.11,0.96,1.01,1.12,0.95,1.05,0.99,1.04,1,1,0.99,0.8,0.96,0.41,0,0.9,0.41,0,"AT2G42490","Peroxisome-localized copper amine oxidase involved in lateral root formation.","COPPER AMINE OXIDASE ZETA (CUAO&#950;-ZETA)","AT2G42490.1","Copper amine oxidase family protein",0.743,0.364,-0.0951,-0.744,0.788,0.844,0.0778,-0.0288
"337","aGkSGGGDPNILAR","AT5G43970.1","N-Term(iTRAQ8plex); K3(iTRAQ8plex)",0.67,1.82,0.98,0.83,0.71,1.2,1.21,0.98,0.8,1.39,2.06,1.02,0.95,0.87,0,1.22,0.87,0,"AT5G43970","Subunit of the TOM complex, a translocase in the outer mitochondrial membrane that selectively allows proteins with a mitochondrial targeting sequence to enter the mitochondrion.","TRANSLOCASE OF OUTER MEMBRANE 22-V (TOM22-V)","AT5G43970.1","TOM9-2",0.152,0.311,-0.995,-1.53,0.8,0.821,-0.119,0.148
"338","vSDSVPAPSDDAEQLR","AT1G35720.1","N-Term(iTRAQ8plex)",1.05,1.32,1.05,0.87,0.92,1.06,1.15,0.95,0.92,0.95,1.13,0.78,0.95,0.66,0,0.88,0.66,0,"AT1G35720","Encodes a member of the annexin gene family, a diverse, multigene family of calcium-dependent, membrane-binding proteins. The protein was determined to have peroxidase activity. This activity is thought to be dependent on the presence of post-translational modifications (most likely phosphorylation). The protein was shown to be present as a mixture of monomer and homodimer. The homodimerization seems to be dependent on the presence of Ca2+ or H2O2. The dimerization was prevented by the addition of DTT, &#946;-mercaptoethanol and TCEP. Annat1 mRNA is expressed in flowers, roots,leaves and stems and is most abundant in stems. mRNA levels are increased in response to oxidative stress.  Developmental expression patterns suggest a role in Golgi-mediated polysaccharide secretion. It is a Ca  2+-permeable transporter providing a molecular link between reactive oxygen species and cytosolic Ca 2+ in plants. The mRNA is cell-to-cell mobile.","ANNEXIN 1 (ANNAT1)","AT1G35720.1","ANN1",0.436,0.815,-0.552,-0.349,0.828,0.681,0.0345,-0.42
"339","vkFTADELR","AT1G56070.3","N-Term(iTRAQ8plex); K2(iTRAQ8plex)",0.97,1.1,1.14,0.86,0.84,1.03,0.96,1.04,1.13,0.95,1.16,0.86,0.95,0.56,0,1.01,0.56,0,"AT1G56070","encodes a translation elongation factor 2-like protein that is involved in cold-induced translation. Mutations in this gene specifically blocks low temperature-induced transcription of cold-responsive genes but induces the expression of CBF genes and mutants carrying the recessive mutations fail to acclimate to cold and is freezing sensitive.","LOW EXPRESSION OF OSMOTICALLY RESPONSIVE GENES 1 (LOS1)","AT1G56070.3","LOS1",0.74,0.611,0.154,-0.768,0.683,0.831,-0.27,-0.091
"342","sPNVAYLPGGQSMLFALNR","AT5G40770.1","N-Term(iTRAQ8plex)",1.02,0.93,0.82,1,0.56,0.98,0.93,1.11,1.03,1.06,1.02,1,0.95,0.73,0,1.09,0.73,0,"AT5G40770","prohibitin 3","PROHIBITIN 3 (PHB3)","AT5G40770.1","PHB3",0.49,0.581,-1.3,-2.33,0.828,0.827,0.0887,0.291
"343","aQEADGIR","AT2G26230.1","N-Term(iTRAQ8plex)",1.02,1.1,1.02,1.07,1.05,0.96,1.03,0.95,0.89,0.98,0.98,0.95,0.95,0.16,0,0.9,0.16,0,"AT2G26230","Encodes a urate oxidase that is involved in peroxisome maintenance.","URATE OXIDASE (UOX)","AT2G26230.1","Uricase",0.749,0.675,0.11,-0.525,0.806,0.724,-0.0687,-0.262
"346","sASLGEELR","AT5G46180.1","N-Term(iTRAQ8plex)",1,0.75,1.12,0.87,0.85,1,0.8,0.9,1.28,1.17,1.25,1.1,0.95,0.6,0,1.28,0.6,0,"AT5G46180","Encodes an ornithine delta-aminotransferase that is transcriptionally up-regulated in young seedlings and in response to salt stress. It is unlikely to play a role in salt-stress-induced proline accumulation, however, it appears to participate in arginine and ornithine catabolism.","ORNITHINE-DELTA-AMINOTRANSFERASE (DELTA-OAT)","AT5G46180.1","DELTA-OAT",0.375,0.542,0.186,0.296,0.671,0.385,0.0934,0.231
"347","lAGDSAAYQR","AT2G33150.1","N-Term(iTRAQ8plex)",0.94,1.06,0.91,1.01,0.88,0.88,0.99,0.95,1.43,1.5,1.17,1.1,0.95,0.28,0,1.33,0.28,0,"AT2G33150","Encodes an organellar (peroxisome, glyoxysome) 3-ketoacyl-CoA thiolase, involved in fatty acid b-oxidation during germination and subsequent seedling growth. Mutants have defects in glyoxysomal fatty acid beta-oxidation. EC2.3.1.16 thiolase.","PEROXISOMAL 3-KETOACYL-COA THIOLASE 3 (PKT3)","AT2G33150.1","PED1",0.256,0.875,-0.457,0.0298,0.541,0.0491,0.266,0.837
"349","sGGAPGGAGGESSTEEEDESHDEL","AT5G28540.1","N-Term(iTRAQ8plex)",1.06,1.07,0.89,1.3,0.99,1,0.95,1.13,1,0.87,1.05,0.91,0.95,0.56,0,0.89,0.56,0,"AT5G28540","Encodes the luminal binding protein BiP, an ER-localized member of the HSP70 family.  BiP is composed of an N-terminal ATP binding domain and a C-terminal domain that binds to hydrophobic patches on improperly/incompletely folded proteins in an ATP-dependent manner. Involved in polar nuclei fusion during proliferation of endosperm nuclei.","(BIP1)","AT5G28540.1","MED37A",0.142,0.621,-1.22,-1.08,0.796,0.848,-0.153,0.0446
"353","yAAkDISFGIGAR","AT3G13860.1","N-Term(iTRAQ8plex); K4(iTRAQ8plex)",0.82,1.04,1.35,0.94,0.96,1.22,0.67,1.06,1.62,0.89,1.77,0.86,0.94,0.72,0,1.24,0.72,0,"AT3G13860","heat shock protein 60-3A;(source:Araport11)","HEAT SHOCK PROTEIN 60-3A (HSP60-3A)","AT3G13860.1","HSP60-3A",0.781,0.863,-0.0203,0.0352,0.348,0.371,-0.168,-0.224
"354","aSGVGTGAQR","AT1G15820.1","N-Term(iTRAQ8plex)",1.45,0.74,1.23,1.3,1.45,1.08,0.77,1.11,0.92,0.44,0.15,0.89,0.94,0.73,0,0.51,0.73,0,"AT1G15820","Lhcb6 protein (Lhcb6), light harvesting complex of photosystem II.","LIGHT HARVESTING COMPLEX PHOTOSYSTEM II SUBUNIT 6 (LHCB6)","AT1G15820.1","LHCB6",0.134,0.823,-1.06,-0.369,0.838,0.736,0.00705,-0.385
"360","tAVDHGPVR","AT2G31140.1","N-Term(iTRAQ8plex)",1.15,1,0.93,1,0.86,1,0.93,1,0.83,1.32,1.01,1.32,0.93,0.23,0,1.1,0.23,0,"AT2G31140","Peptidase S24/S26A/S26B/S26C family protein;(source:Araport11)","(ATIMP2)","AT2G31140.1","Peptidase S24/S26A/S26B/S26C family protein.1",0.412,0.863,0.414,-0.0888,0.601,0.811,-0.272,-0.117
"361","sPNVAYLPGGQSmLFNLNPGR","AT3G27280.1","N-Term(iTRAQ8plex); M13(Oxidation)",1.09,1.01,1.08,1.11,0.99,0.98,1.02,0.98,1.03,0.9,0.85,0.95,0.92,0.03,0,0.87,0.03,0,"AT3G27280","Part of protein complexes that are necessary for proficient mitochondrial function or  biogenesis, thereby supporting cell division and differentiation in apical tissues","PROHIBITIN 4 (PHB4)","AT3G27280.2","PHB4",0.604,0.855,0.47,-0.214,0.374,0.778,-0.702,0.309
"366","aPVESLTLNQQVR","AT1G54010.1","N-Term(iTRAQ8plex)",0.8,1.25,0.98,1.02,0.83,1.07,1.17,0.65,0.96,1.04,2.32,0.97,0.92,0.62,0,1.31,0.62,0,"AT1G54010","GDSL-motif  esterase/acyltransferase/lipase. Enzyme group with broad substrate specificity that may catalyze acyltransfer or hydrolase reactions with lipid and non-lipid substrates.","GDSL-LIKE LIPASE 23 (GLL23)","AT1G54010.1","GLL23",0.0615,0.505,-1.87,-1.76,0.805,0.703,-0.163,-0.66
"367","fTSAGYPSNSFQLTPPTNWGIR","AT4G27585.1","N-Term(iTRAQ8plex)",0.98,1.02,1.16,0.98,0.79,1.09,0.89,1.02,1.09,0.79,1.21,0.75,0.92,0.35,0,0.93,0.35,0,"AT4G27585","Encodes a stomatin-like protein that is present in a mitochondrial membrane-bound 3 MDa protein complex and is involved in the assembly of mitochondrial respiratory supercomplexes.  There is an observed increase in abundance of respiratory complex III2 in SLP1 single and double knockout mutants. The protein is not redundant with Arabidopsis SLP2 (At5g54100).","STOMATIN-LIKE PROTEIN 1 (SLP1)","AT4G27585.1","SPFH/Band 7/PHB domain-containing membrane-associated protein family",0.306,0.545,-0.826,-1.18,0.839,0.851,0.000371,0.0261
"370","gVTSENVAQR","AT2G33150.1","N-Term(iTRAQ8plex)",1.17,0.87,0.94,1.07,1,0.91,0.89,0.92,1,1.13,1.53,1.06,0.92,0.31,0,1.16,0.31,0,"AT2G33150","Encodes an organellar (peroxisome, glyoxysome) 3-ketoacyl-CoA thiolase, involved in fatty acid b-oxidation during germination and subsequent seedling growth. Mutants have defects in glyoxysomal fatty acid beta-oxidation. EC2.3.1.16 thiolase.","PEROXISOMAL 3-KETOACYL-COA THIOLASE 3 (PKT3)","AT2G33150.1","PED1",0.256,0.875,-0.457,0.0298,0.541,0.0491,0.266,0.837
"372","tTSAGFDPEALER","AT5G16930.1","N-Term(iTRAQ8plex)",1.05,1.02,1.11,0.93,0.96,0.98,0.78,1.04,0.89,1.16,0.96,1.1,0.92,0.26,0,1,0.26,0,"AT5G16930","AAA-type ATPase family protein;(source:Araport11)","","AT5G16930.1","AAA-type ATPase family protein.1",0.582,0.358,-0.284,-0.898,0.79,0.689,-0.0904,0.289
"376","tHLYGWEAENAVENAR","AT5G65720.3","N-Term(iTRAQ8plex)",1.07,0.95,1.33,0.91,1.01,0.96,0.45,1.47,0.99,1.07,0.45,1.09,0.91,0.71,0,0.85,0.71,0,"AT5G65720","Encodes a cysteine desulfurase whose activity is dependent on AtSufE activation. It requires pyridoxal phosphate (PLP) for proper folding.  Its catalytic efficiency is increase three-fold in the presence of AtFH (frataxin).","NITROGEN FIXATION S (NIFS)-LIKE 1 (NFS1)","AT5G65720.3","NIFS1",0.785,0.879,-0.0205,-0.00452,0.527,0.743,-0.148,-0.107
"377","aQGNEIGFGSEVPATVEAVkTPNSkIVYDDHNHER","AT5G13430.1","N-Term(iTRAQ8plex); K20(iTRAQ8plex); K25(iTRAQ8plex)",1.03,1.14,0.92,1,0.87,0.97,1.03,0.87,0.96,1.12,1.13,1,0.91,0.18,0,1.03,0.18,0,"AT5G13430","Ubiquinol-cytochrome C reductase iron-sulfur subunit;(source:Araport11)","","AT5G13430.1","Ubiquinol-cytochrome C reductase iron-sulfur subunit",0.167,0.675,-1.05,-0.858,0.714,0.835,-0.306,-0.103
"378","aQGNEIGFGSEVPATVEAVkTPNSkIVYDDHNHER","AT5G13430.1","N-Term(iTRAQ8plex); K20(iTRAQ8plex); K25(iTRAQ8plex)",1.03,1.14,0.92,1,0.87,0.97,1.03,0.87,0.96,1.12,1.13,1,0.91,0.18,0,1.03,0.18,0,"AT5G13430","Ubiquinol-cytochrome C reductase iron-sulfur subunit;(source:Araport11)","","AT5G13430.1","Ubiquinol-cytochrome C reductase iron-sulfur subunit.1",0.423,0.836,-0.774,-0.36,0.735,0.838,-0.306,-0.103
"381","sSSLNTVIQR","AT1G06460.1","N-Term(iTRAQ8plex)",1.26,1.04,0.97,1.23,0.84,0.99,0.95,1.31,0.87,1.01,1.03,0.75,0.91,0.45,0,0.81,0.45,0,"AT1G06460","ACD32.1 encodes an alpha-crystallin domain  containing protein with homology to small heat shock proteins.","ALPHA-CRYSTALLIN DOMAIN 32.1 (ACD32.1)","AT1G06460.1","ACD32.1",0.756,0.595,-0.151,-0.982,0.558,0.0517,-0.473,-1.53
"382","sSQTILATGGYGR","AT5G66760.1","N-Term(iTRAQ8plex)",1.22,0.94,1.08,1.08,0.92,1,1,1,1.02,1,0.94,0.87,0.91,0.18,0,0.89,0.18,0,"AT5G66760","One of two genes in Arabidopsis that encode a flavoprotein subunit of the  mitochondrial succinate dehydrogenase complex. The mRNA is cell-to-cell mobile.","SUCCINATE DEHYDROGENASE 1-1 (SDH1-1)","AT5G66760.1","SDH1-1",0.0909,0.525,-0.331,-0.326,0.279,0.494,-0.208,-0.209
"383","dSVPAPSDDAEQLR","AT1G35720.1","N-Term(iTRAQ8plex)",1.06,1.06,1.04,1.06,1.07,0.9,0.97,0.87,0.94,0.76,1.03,0.84,0.9,0.11,0,0.84,0.11,0,"AT1G35720","Encodes a member of the annexin gene family, a diverse, multigene family of calcium-dependent, membrane-binding proteins. The protein was determined to have peroxidase activity. This activity is thought to be dependent on the presence of post-translational modifications (most likely phosphorylation). The protein was shown to be present as a mixture of monomer and homodimer. The homodimerization seems to be dependent on the presence of Ca2+ or H2O2. The dimerization was prevented by the addition of DTT, &#946;-mercaptoethanol and TCEP. Annat1 mRNA is expressed in flowers, roots,leaves and stems and is most abundant in stems. mRNA levels are increased in response to oxidative stress.  Developmental expression patterns suggest a role in Golgi-mediated polysaccharide secretion. It is a Ca  2+-permeable transporter providing a molecular link between reactive oxygen species and cytosolic Ca 2+ in plants. The mRNA is cell-to-cell mobile.","ANNEXIN 1 (ANNAT1)","AT1G35720.1","ANN1",0.436,0.815,-0.552,-0.349,0.828,0.681,0.0345,-0.42
"385","fHVELGAR","AT3G47833.1","N-Term(iTRAQ8plex)",0.81,1.19,0.7,1.21,0.59,1.24,0.71,0.98,0.48,1.62,1.02,1.76,0.9,0.63,0,1.24,0.63,0,"AT3G47833","predicted to encode subunit 7 of mitochondrial complex II and to participate in the respiratory chain","SUCCINATE DEHYDROGENASE 7 (SDH7)","AT3G47833.1","SDH7A",0.802,0.826,0.0245,-0.863,0.037,0.208,-2.92,-2.81
"387","tTQVQDGVR","AT4G35630.1","N-Term(iTRAQ8plex)",1.04,1.43,0.78,1.08,0.9,0.97,0.92,1.09,0.81,1.03,1.69,0.75,0.9,0.48,0,0.99,0.48,0,"AT4G35630","Encodes a phosphoserine aminotransferase which is involved in serine biosynthesis in the chloroplast which operates via the phosphorylated pathway. The mRNA is cell-to-cell mobile.","PHOSPHOSERINE AMINOTRANSFERASE 1 (PSAT1)","AT4G35630.1","PSAT1",0.69,0.765,-0.23,-0.454,0.366,0.704,0.509,0.346
