"","Sequence","prot_acc","Modifications","col-0.1","col-0.2","col-0.3","col-0.4","clp1.1","clp1.2","clp1.3","clp1.4","clp2.1","clp2.2","clp2.3","clp2.4","clp1/col-0 Ratio","clp1/col-0 TTEST","clp1/col-0 REGULATION","clp2/col-0 Ratio","clp2/col-0 TTEST","clp2/col-0 REGULATION","gene","Gene Model Name","Gene Model Type","ID","name","clp1p__vs_wtp__p.adj","clp2p__vs_wtp__p.adj","clp1p__vs_wtp__ratio","clp2p__vs_wtp__ratio","clp1s__vs_wts__p.adj","clp2s__vs_wts__p.adj","clp1s__vs_wts__ratio","clp2s__vs_wts__ratio"
"131","sSTmSPSEADR","AT1G64880.1","N-Term(iTRAQ8plex); M4(Oxidation)",0.87,0.68,0.97,0.64,1.32,1.09,1.03,1.06,1.11,0.91,1.07,0.96,1.42,0.02,0,1.28,0.02,0,"AT1G64880","Ribosomal protein S5 family protein;(source:Araport11)","","AT1G64880.1","Ribosomal protein S5 family protein",0.0042,0.318,1.58,1.39,0.00758,0.0319,1.29,1.49
"132","sADTSVAPLGSLkGTLTIVDER","AT2G42790.1","N-Term(iTRAQ8plex); K13(iTRAQ8plex)",0.98,0.95,0.4,1.53,1.02,0.92,0.47,3.05,1.31,1.46,0.24,2.74,1.41,0.55,0,1.49,0.55,0,"AT2G42790","Encodes a peroxisomal citrate synthase that is expressed throughout seedling and shoot development.","CITRATE SYNTHASE 3 (CSY3)","AT2G42790.1","CSY3",0.259,0.836,-0.462,-0.166,0.567,0.144,0.256,0.695
"133","aGDSAAYQR","AT2G33150.1","N-Term(iTRAQ8plex)",0.7,0.96,0.42,0.88,1.04,0.94,1.11,1.05,1.35,1.85,0.95,1.46,1.4,0.09,0,1.9,0.09,0,"AT2G33150","Encodes an organellar (peroxisome, glyoxysome) 3-ketoacyl-CoA thiolase, involved in fatty acid b-oxidation during germination and subsequent seedling growth. Mutants have defects in glyoxysomal fatty acid beta-oxidation. EC2.3.1.16 thiolase.","PEROXISOMAL 3-KETOACYL-COA THIOLASE 3 (PKT3)","AT2G33150.1","PED1",0.256,0.875,-0.457,0.0298,0.541,0.0491,0.266,0.837
"134","sSGTPPPPQAPSPNQDLNR","AT5G67490.1","N-Term(iTRAQ8plex)",0.52,1.06,0.57,0.82,0.96,1.04,1.07,1.07,2.44,0.94,2.04,0.93,1.4,0.1,0,2.15,0.1,0,"AT5G67490","SDHAF4 acts on FAD-SDH1 and promotes its assembly with SDH2, thereby stabilizing SDH2 and enabling its full assembly with SDH3/SDH4 to form the SDH complex.","SUCCINATE DEHYDROGENASE ASSEMBLY FACTOR 4 (SDHAF4)","AT5G67490.1"," succinate dehydrogenase assembly factor ",0.697,0.87,0.575,0.188,0.686,0.78,0.676,-0.57
"139","vTGEALIAYR","AT3G62810.1","N-Term(iTRAQ8plex)",0.75,0.86,0.68,0.7,1.03,0.97,1.02,1.01,1.25,1.11,1.23,0.99,1.34,0,0,1.53,0,0,"AT3G62810","complex 1 family protein / LVR family protein;(source:Araport11)","","AT3G62810.2","complex 1 family protein / LVR family protein",0.802,0.881,-0.0131,0.00377,0.46,0.829,-0.659,0.14
"140","sSGGLSDDEINR","AT4G37910.1","N-Term(iTRAQ8plex)",0.75,0.88,0.89,0.61,1.19,1.02,1.09,0.91,0.99,1.01,1.15,1.11,1.34,0.02,0,1.36,0.02,0,"AT4G37910","mitochondrial heat shock protein 70-1;(source:Araport11)","MITOCHONDRIAL HEAT SHOCK PROTEIN 70-1 (mtHsc70-1)","AT4G37910.2","HSP70-9",5.47e-05,0.0135,0.565,0.669,3.1e-06,0.000559,0.546,0.572
"141","iSTQVVRNR","AT2G33040.1","N-Term(iTRAQ8plex)",0.89,0.72,0.87,0.82,1,1.26,1.03,1.12,1.34,1,1.13,0.97,1.34,0.01,0,1.35,0.01,0,"AT2G33040","gamma subunit of Mt ATP synthase;(source:Araport11)","GAMMA SUBUNIT OF MT ATP SYNTHASE (ATP3)","AT2G33040.1","ATPC",0.0539,0.337,1.63,1.89,0.53,0.823,0.639,0.185
"143","vSEVSPmAAFGDDIVIVAAYR","AT5G48880.3","N-Term(iTRAQ8plex); M7(Oxidation)",1.21,0.84,0.73,0.72,1.49,0.99,0.92,1.25,0.89,1.01,1.08,1.13,1.33,0.15,0,1.18,0.15,0,"AT5G48880","Encodes a peroxisomal 3-keto-acyl-CoA thiolase 2 precursor. EC2.3.1.16 thiolases. AT5G48880.1 is named PKT1 and AT5G48880.2 is named PKT2.","3-KETO-ACYL-COENZYME A THIOLASE 5 (KAT5)","AT5G48880.1","KAT5",0.705,0.842,0.26,-0.266,0.438,0.137,0.578,1.26
"144","sYSDLLIR","AT5G03860.1","N-Term(iTRAQ8plex)",0.88,0.46,0.65,0.95,0.79,1.12,1.05,0.93,2.84,3.67,2.75,3.25,1.32,0.14,0,4.24,0.14,0,"AT5G03860","Encodes a protein with malate synthase activity.","MALATE SYNTHASE (MLS)","AT5G03860.2","MLS",0.769,0.417,0.169,1.92,0.53,0.0263,0.724,2.43
"145","sLPSEAVDEkER","AT4G37930.1","N-Term(iTRAQ8plex); K10(iTRAQ8plex)",0.57,1.19,0.47,1.29,0.82,1.19,0.71,1.91,0.91,1.09,0.58,1.54,1.31,0.45,0,1.17,0.45,0,"AT4G37930","Encodes a protein with mitochondrial serine hydroxymethyltransferase activity, which functions in the photorespiratory pathway, catalyzes the conversion of serine and tetrahydrofolate to glycine and 5,10-methylene tetrahydrofolate.  Involved in controlling cell damage caused by abiotic stress, such as high light and salt and the hypersensitive defense response of plants.","SERINE TRANSHYDROXYMETHYLTRANSFERASE 1 (SHM1)","AT4G37930.1","SHM1",0.254,0.866,0.225,0.0316,0.327,0.745,0.181,0.0952
"147","sTTAAAAASTIR","AT1G07830.1","N-Term(iTRAQ8plex)",0.7,0.7,0.92,0.98,1.28,0.96,0.87,1.18,1.24,1.04,1.3,1.02,1.3,0.09,0,1.4,0.09,0,"AT1G07830","ribosomal protein L29 family protein;(source:Araport11)","","AT1G07830.1","ribosomal protein L29 family protein",0.79,0.538,0.0401,-0.866,0.61,0.796,0.328,-0.181
"148","lMScGTVNGNLAGcIAYLTR","AT2G38530.1","N-Term(iTRAQ8plex); C4(Carbamidomethyl); C14(Carbamidomethyl)",0.89,1.04,0.79,0.67,0.96,1.07,1.04,1.32,1.04,0.96,1.52,0.96,1.3,0.06,0,1.32,0.06,0,"AT2G38530","Involved in lipid transfer between membranes and plays a role in maintaining the integrity of the cuticle-cell wall interface. Belongs to a family of Lipid transfer proteins. Sequence similarity to other plant/Arabidopsis LPT genes but highest similarity to LPT1. Stress and pathogen-inducible motifs found in the upstream region. Expressed in flower, leaves and siliques but absent in roots. Predicted to be a member of PR-14 pathogenesis-related protein family with the following members:   At2g38540/LTP1, At2g38530/LTP2, At5g59320/LTP3, At5g59310/LTP4, At3g51600/LTP5, At3g08770/LTP6, At2g15050/LTP7, At2g18370/LTP8, At2g15325/LTP9, At5g01870/LTP10, At4g33355/LTP11, At3g51590/LTP12, At5g44265/LTP13, At5g62065/LTP14, At4g08530/LTP15.","LIPID TRANSFER PROTEIN 2 (LTP2)","AT2G38530.1","LTP2",0.789,0.698,-0.0402,-0.564,0.662,0.751,0.269,-0.257
"150","gSSVNLGR","AT5G53350.1","N-Term(iTRAQ8plex)",0.89,0.84,0.82,0.75,1.08,1.01,1.06,1.08,0.99,1.05,1.09,0.94,1.28,0,0,1.24,0,0,"AT5G53350","CLP protease regulatory subunit CLPX mRNA, nuclear gene","CLP PROTEASE REGULATORY SUBUNIT X (CLPX)","AT5G53350.1","CLPX",1.72e-08,0.00905,0.845,0.791,1.21e-08,1.01e-07,0.722,0.892
"153","iSTQVVR","AT2G33040.1","N-Term(iTRAQ8plex)",0.95,0.78,0.95,0.79,0.93,1.24,1.05,1.16,1.32,1.05,1.08,0.95,1.27,0.03,0,1.27,0.03,0,"AT2G33040","gamma subunit of Mt ATP synthase;(source:Araport11)","GAMMA SUBUNIT OF MT ATP SYNTHASE (ATP3)","AT2G33040.1","ATPC",0.0539,0.337,1.63,1.89,0.53,0.823,0.639,0.185
"154","eSTTAAAAASTIR","AT1G07830.1","N-Term(iTRAQ8plex)",0.81,0.95,0.83,0.75,1.04,1.04,1.12,0.99,0.96,1.16,1.01,1.01,1.26,0.01,0,1.24,0.01,0,"AT1G07830","ribosomal protein L29 family protein;(source:Araport11)","","AT1G07830.1","ribosomal protein L29 family protein",0.79,0.538,0.0401,-0.866,0.61,0.796,0.328,-0.181
"157","aTQEEAAAER","AT3G49240.1","N-Term(iTRAQ8plex)",0.81,0.71,0.94,0.93,1.01,1,1.02,1.16,1.03,1,1.43,0.98,1.23,0.03,0,1.31,0.03,0,"AT3G49240","Encodes NUWA, an imprinted gene that controls mitochondrial function in early seed development.  It is expressed in both the mitochondrion and chloroplast and is also involved in RNA editing in the mitochondrion and chloroplast as a core member of E+-type PPR editosomes.","NUWA (NUWA)","AT3G49240.1","EMB1796",0.0223,0.3,0.696,0.75,0.8,0.331,-0.0574,0.45
"158","aGEEDWR","AT4G31830.1","N-Term(iTRAQ8plex)",0.86,1.09,0.9,0.83,0.81,1.26,1.52,0.95,0.91,1.24,1.16,1.05,1.23,0.28,0,1.18,0.28,0,"AT4G31830","transmembrane protein;(source:Araport11)","","AT4G31830.1"," transmembrane protein .8",0.803,0.743,0.0043,-0.533,0.35,0.777,-0.549,-0.236
"160","tIHAAVIQkLLNTGAHLGR","AT3G03600.1","N-Term(iTRAQ8plex); K9(iTRAQ8plex)",0.84,0.93,0.84,0.8,0.97,1.14,0.76,1.28,1.03,1.11,1.17,1.16,1.22,0.19,0,1.31,0.19,0,"AT3G03600","Structural component of the mitochondrial ribosome small subunit","RIBOSOMAL PROTEIN S2 (RPS2)","AT3G03600.1","RPS2",0.544,0.781,0.502,0.523,0.619,0.29,0.408,1
"162","sYLFFDGR","AT1G54010.1","N-Term(iTRAQ8plex)",0.81,1.15,0.54,0.72,0.73,1.05,1.28,0.86,0.95,1.51,1.14,1.31,1.22,0.36,0,1.53,0.36,0,"AT1G54010","GDSL-motif  esterase/acyltransferase/lipase. Enzyme group with broad substrate specificity that may catalyze acyltransfer or hydrolase reactions with lipid and non-lipid substrates.","GDSL-LIKE LIPASE 23 (GLL23)","AT1G54010.1","GLL23",0.0615,0.505,-1.87,-1.76,0.805,0.703,-0.163,-0.66
"163","sESTTAAAAASTIR","AT1G07830.1","N-Term(iTRAQ8plex)",0.98,1.02,0.96,0.85,1.16,1.05,1.24,1.14,0.89,0.95,0.95,1.04,1.21,0.01,0,1.01,0.01,0,"AT1G07830","ribosomal protein L29 family protein;(source:Araport11)","","AT1G07830.1","ribosomal protein L29 family protein",0.79,0.538,0.0401,-0.866,0.61,0.796,0.328,-0.181
"166","aADTPLLTGQR","AT1G78900.2","N-Term(iTRAQ8plex)",1,1,1.06,0.82,1,1.12,1.63,0.89,0.78,0.94,1.24,0.94,1.19,0.34,0,1.01,0.34,0,"AT1G78900","Encodes catalytic subunit A of the vacuolar ATP synthase.  Mutants are devoid of vacuolar ATPase activity as subunit A is encoded only by this gene and show strong defects in male gametophyte development and in Golgi stack morphology. The mRNA is cell-to-cell mobile.","VACUOLAR ATP SYNTHASE SUBUNIT A (VHA-A)","AT1G78900.2","VHA-A",0.377,0.259,-0.449,-1.09,0.525,0.496,-0.328,-0.47
"167","cHTSAHQAELLR","AT3G58140.1","N-Term(iTRAQ8plex); C1(Carbamidomethyl)",1.03,0.8,0.94,0.84,1.13,0.97,1.14,1.06,1.46,0.93,1.51,0.94,1.19,0.04,0,1.34,0.04,0,"AT3G58140","phenylalanyl-tRNA synthetase class IIc family protein;(source:Araport11)","","AT3G58140.1","Phenylalanine--tRNA ligase, chloroplastic/mitochondrial",0.792,0.874,-0.0162,-0.0214,0.311,0.787,0.245,0.0901
"169","aSNAAVPFWR","AT1G51650.1","N-Term(iTRAQ8plex)",0.89,0.91,0.99,0.94,1.12,0.98,1.15,1.14,1.05,1.02,1.01,0.96,1.18,0.02,0,1.08,0.02,0,"AT1G51650","ATP synthase epsilon chain;(source:Araport11)","","AT1G51650.1","ATP synthase subunit epsilon, mitochondrial",0.701,0.625,0.443,-1.47,0.667,0.705,0.574,0.711
"171","pSLQTSLPPELANNVVR","AT3G17300.3","N-Term(iTRAQ8plex)",0.96,1.01,0.86,0.86,0.97,1.14,1.14,1.11,1.02,0.99,1.11,0.89,1.18,0.03,0,1.09,0.03,0,"AT3G17300","COMPLEX 1 LYR-like protein;(source:Araport11)","AT3G17300 (EMB2786)","AT3G17300.3"," COMPLEX 1 LYR-like protein ",0.364,0.812,0.76,0.441,0.678,0.835,-0.365,-0.104
"172","sASTTVGSEQR","AT2G17630.1","N-Term(iTRAQ8plex)",1,1,0.72,1.16,1.11,1.16,1.11,1.19,0.87,0.97,0.89,0.78,1.18,0.15,0,0.9,0.15,0,"AT2G17630","Pyridoxal phosphate (PLP)-dependent transferases superfamily protein;(source:Araport11)","PHOSPHOSERINE AMINOTRANSFERASE 2 (PSAT2)","AT2G17630.1","PSAT2",0.749,0.482,0.0922,-0.669,0.458,0.433,-0.312,-0.437
"173","sDQNPIVYIEDTTR","AT1G31817.1","N-Term(iTRAQ8plex)",0.96,0.84,0.8,0.9,0.89,1.07,1,1.16,1.04,1.13,1,1.16,1.18,0.07,0,1.24,0.07,0,"AT1G31817","Ribosomal L18p/L5e family protein;(source:Araport11)","NUCLEAR FUSION DEFECTIVE 3 (NFD3)","AT1G31817.1","NFD3",0.00261,0.402,1.01,0.767,0.107,0.386,0.539,0.482
"174","cGVGFVAELSGETTR","AT5G53460.3","N-Term(iTRAQ8plex); C1(Carbamidomethyl)",0.94,1.22,0.72,0.97,1.14,1.06,1.03,1.3,0.89,0.86,1.05,0.97,1.17,0.22,0,0.98,0.22,0,"AT5G53460","NADH-dependent glutamate synthase The mRNA is cell-to-cell mobile.","NADH-DEPENDENT GLUTAMATE SYNTHASE 1 (GLT1)","AT5G53460.3","GLT1",0.79,0.466,0.0331,-0.814,0.635,0.699,0.256,-0.293
"176","gGGGNYQGGGGNYQGGGGNYQGGGGR","AT2G05520.1","N-Term(iTRAQ8plex)",0.86,1.39,0.55,0.85,1.25,0.91,1.32,0.82,1.07,0.93,1.23,1.15,1.17,0.49,0,1.19,0.49,0,"AT2G05520","Encodes a glycine-rich protein that is expressed mainly in stems and leaves.  AtGRP3 functions in root size determination during development and in Al stress. mRNA levels are upregulated in response to ABA, salicylic acid and ethylene but downregulated in response to desiccation. The mRNA is cell-to-cell mobile.","GLYCINE-RICH PROTEIN 3 (GRP-3)","AT2G05520.5","Glycine-rich protein family",0.694,0.589,-0.341,-1.19,0.482,0.359,-0.652,-1.08
"177","gGGGNYQGGGGNYQGGGGNYQGGGGR","AT2G05520.1","N-Term(iTRAQ8plex)",0.86,1.39,0.55,0.85,1.25,0.91,1.32,0.82,1.07,0.93,1.23,1.15,1.17,0.49,0,1.19,0.49,0,"AT2G05520","Encodes a glycine-rich protein that is expressed mainly in stems and leaves.  AtGRP3 functions in root size determination during development and in Al stress. mRNA levels are upregulated in response to ABA, salicylic acid and ethylene but downregulated in response to desiccation. The mRNA is cell-to-cell mobile.","GLYCINE-RICH PROTEIN 3 (GRP-3)","AT2G05520.5","GRP3",0.685,0.823,0.301,-0.362,0.626,0.256,-0.403,-1.06
"179","aSWSNSSTPGR","AT1G71260.1","N-Term(iTRAQ8plex)",0.95,0.96,1.08,0.81,1.04,1.09,1.21,1.12,1.1,0.9,0.92,0.89,1.17,0.06,0,1,0.06,0,"AT1G71260","Encodes WHY2, a homolog of the potato p24 protein.  It shares the conserved KGKAAL domain, a putative DNA-binding domain, with potato p24 and is localized to mitochondria and not the nucleus.  WHY2 is a member of the Whirly family proteins present mainly in the plant kingdom performing various activities related to DNA metabolism.  Crystal structure of Solanum tuberosum WHY2, a close homolog of Arabidopsis WHY2, reveal that Whirly proteins bind to single strand DNA to promote accurate repair of DNA double-strand breaks over an error-prone repair pathway.","WHIRLY 2 (ATWHY2)","AT1G71260.1","WHY2",0.793,0.433,-0.0303,-0.965,0.557,0.597,-0.352,0.446
"180","sIPEGAVVcNVEHHVGDR","AT2G18020.1","N-Term(iTRAQ8plex); C9(Carbamidomethyl)",0.87,0.77,1.01,0.95,1.13,1.31,0.99,0.79,0.74,1.34,1.04,1.08,1.17,0.27,0,1.16,0.27,0,"AT2G18020","Ribosomal protein L2 family;(source:Araport11)","EMBRYO DEFECTIVE 2296 (EMB2296)","AT2G18020.1","RPL8A",0.784,0.832,-0.0702,-0.312,0.689,0.23,-0.316,-1.07
"181","sIPEGAVVcNVEHHVGDR","AT2G18020.1","N-Term(iTRAQ8plex); C9(Carbamidomethyl)",0.87,0.77,1.01,0.95,1.13,1.31,0.99,0.79,0.74,1.34,1.04,1.08,1.17,0.27,0,1.16,0.27,0,"AT2G18020","Ribosomal protein L2 family;(source:Araport11)","EMBRYO DEFECTIVE 2296 (EMB2296)","AT2G18020.1","RPL8C",0.626,0.765,-0.386,-0.562,0.713,0.304,-0.281,-0.96
"182","gFImEFAENLVLR","AT1G67350.2","N-Term(iTRAQ8plex); M4(Oxidation)",0.71,0.77,0.86,1.05,0.81,1.19,0.99,0.98,1.28,1.41,1.01,1.02,1.17,0.23,0,1.39,0.23,0,"AT1G67350","NADH-ubiquinone oxidoreductase;(source:Araport11)","","AT1G67350.2","P1/11 kDa",0.649,0.864,0.296,0.111,0.169,0.819,-0.698,-0.128
"183","gVSTAAYFAR","AT4G34700.1","N-Term(iTRAQ8plex)",0.88,1.03,0.86,0.86,1.05,0.95,1.21,1.01,0.98,1.02,1.04,0.99,1.16,0.09,0,1.11,0.09,0,"AT4G34700","Encodes the B22 subunit of eukaryotic mitochondrial Complex I. Mutation in the gene display pleiotropic phenotypes including shorter roots, smaller plants and delayed flowering. The mRNA is cell-to-cell mobile.","B22 SUBUNIT OF EUKARYOTIC MITOCHONDRIAL COMPLEX I (CIB22)","AT4G34700.1","B22",0.0601,0.787,-0.8,-0.321,0.781,0.802,-0.105,-0.135
"184","ySLLSLNDLR","AT5G64670.1","N-Term(iTRAQ8plex)",1.02,0.76,1.04,0.96,0.9,1.18,0.95,1.33,1.54,0.98,1.38,0.96,1.15,0.28,0,1.29,0.28,0,"AT5G64670","Ribosomal protein L18e/L15 superfamily protein;(source:Araport11)","","AT5G64670.1","Ribosomal protein L18e/L15 superfamily protein",0.000611,0.0428,1.07,1.29,2.97e-14,5.04e-14,2.58,2.65
"185","iHQYQTIQAIPR","AT5G66860.1","N-Term(iTRAQ8plex)",0.67,1.3,0.82,1.13,0.7,1.86,0.55,1.37,0.49,2.24,0.87,1.82,1.15,0.69,0,1.38,0.69,0,"AT5G66860","Ribosomal protein L25/Gln-tRNA synthetase, anti-codon-binding domain-containing protein;(source:Araport11)","","AT5G66860.1","Ribosomal protein L25/Gln-tRNA synthetase, anti-codon-binding domain.1",0.0293,0.441,0.841,0.77,0.377,0.762,0.38,0.191
"188","sSDTGLMDGGGSDIIGAQTR","AT3G17465.1","N-Term(iTRAQ8plex)",0.8,1.14,0.93,0.85,1.02,0.98,0.97,1.25,0.98,1.04,1.05,1.03,1.14,0.26,0,1.1,0.26,0,"AT3G17465","encodes a putative L3 ribosomal protein targeted to the plastid.","RIBOSOMAL PROTEIN L3 PLASTID (RPL3P)","AT3G17465.1","RPL3B",0.719,0.75,-0.277,-0.731,0.262,0.753,0.869,0.402
"190","gGPPLPSGGLPGTDNSDQAR","AT4G05180.2","N-Term(iTRAQ8plex)",1,1,1.06,1.07,1.13,1.04,1.58,0.94,0.42,0.7,0.78,0.85,1.13,0.4,0,0.67,0.4,0,"AT4G05180","Encodes the PsbQ subunit of the oxygen evolving complex of photosystem II.","PHOTOSYSTEM II SUBUNIT Q-2 (PSBQ-2)","AT4G05180.2","PSBQ2",0.597,0.87,0.282,-0.0595,0.816,0.371,-0.0492,-0.569
"191","gGGYQGGGGNYQGGGGNYQGGGGNYQGGGGR","AT2G05520.1","N-Term(iTRAQ8plex)",0.94,1.06,0.59,0.79,1.1,0.71,1.15,0.87,1.31,0.78,1.13,1.27,1.13,0.46,0,1.33,0.46,0,"AT2G05520","Encodes a glycine-rich protein that is expressed mainly in stems and leaves.  AtGRP3 functions in root size determination during development and in Al stress. mRNA levels are upregulated in response to ABA, salicylic acid and ethylene but downregulated in response to desiccation. The mRNA is cell-to-cell mobile.","GLYCINE-RICH PROTEIN 3 (GRP-3)","AT2G05520.5","Glycine-rich protein family",0.694,0.589,-0.341,-1.19,0.482,0.359,-0.652,-1.08
"192","gGGYQGGGGNYQGGGGNYQGGGGNYQGGGGR","AT2G05520.1","N-Term(iTRAQ8plex)",0.94,1.06,0.59,0.79,1.1,0.71,1.15,0.87,1.31,0.78,1.13,1.27,1.13,0.46,0,1.33,0.46,0,"AT2G05520","Encodes a glycine-rich protein that is expressed mainly in stems and leaves.  AtGRP3 functions in root size determination during development and in Al stress. mRNA levels are upregulated in response to ABA, salicylic acid and ethylene but downregulated in response to desiccation. The mRNA is cell-to-cell mobile.","GLYCINE-RICH PROTEIN 3 (GRP-3)","AT2G05520.5","GRP3",0.685,0.823,0.301,-0.362,0.626,0.256,-0.403,-1.06
"196","vASTTQVQDGVR","AT4G35630.1","N-Term(iTRAQ8plex)",1.03,1.15,0.86,0.94,0.83,1.25,1.34,1.06,0.96,0.97,1.17,0.71,1.13,0.38,0,0.96,0.38,0,"AT4G35630","Encodes a phosphoserine aminotransferase which is involved in serine biosynthesis in the chloroplast which operates via the phosphorylated pathway. The mRNA is cell-to-cell mobile.","PHOSPHOSERINE AMINOTRANSFERASE 1 (PSAT1)","AT4G35630.1","PSAT1",0.69,0.765,-0.23,-0.454,0.366,0.704,0.509,0.346
"201","aLQSDNSTVNR","AT5G35630.1","N-Term(iTRAQ8plex)",0.95,1.05,0.87,1.16,1.12,1.19,1.17,1.03,0.75,0.95,0.97,0.88,1.12,0.16,0,0.88,0.16,0,"AT5G35630","chloroplastic glutamine synthetase The mRNA is cell-to-cell mobile.","GLUTAMINE SYNTHETASE 2 (GS2)","AT5G35630.3","GLN2",0.788,0.616,-0.0527,-0.832,0.694,0.722,0.284,-0.363
"202","aAQTTAPAESTASVDADR","AT2G15620.1","N-Term(iTRAQ8plex)",0.88,1,0.63,1.13,1,1.06,0.93,1.07,1.07,0.84,1.1,0.69,1.12,0.4,0,1.02,0.4,0,"AT2G15620","Involved in the second step of nitrate assimilation.  Its expression is induced by nitrate. The mRNA is cell-to-cell mobile.","NITRITE REDUCTASE 1 (NIR1)","AT2G15620.1","NIR1",0.768,0.561,-0.0848,-0.751,0.0176,0.666,0.916,0.355
"204","sVATTQLGIPTDDLVGNHTAkWmQDR","AT3G03070.1","N-Term(iTRAQ8plex); K21(iTRAQ8plex); M23(Oxidation)",0.99,1.1,0.71,1.32,1.03,1.01,0.57,1.96,0.95,0.88,0.81,1.19,1.11,0.74,0,0.93,0.74,0,"AT3G03070","NADH-ubiquinone oxidoreductase-like protein;(source:Araport11)","","AT3G03070.1","13 kDa",0.733,0.859,0.375,-0.307,0.775,0.705,-0.323,0.796
"205","sLGIQAIGLEGDVR","AT3G12800.1","N-Term(iTRAQ8plex)",0.94,0.93,0.93,0.98,0.97,1.03,1.11,1.07,1.05,1.24,0.99,1.01,1.11,0.04,0,1.14,0.04,0,"AT3G12800","short-chain dehydrogenase-reductase B;(source:Araport11)","SHORT-CHAIN DEHYDROGENASE-REDUCTASE B (SDRB)","AT3G12800.1","SDRB",0.285,0.772,-0.978,-0.681,0.835,0.855,0.0177,-0.00317
"209","sSYVGSFAR","AT2G26140.1","N-Term(iTRAQ8plex)",0.95,0.95,0.98,0.88,1.05,1.05,0.94,1.09,1.22,0.94,1.2,1.02,1.1,0.06,0,1.16,0.06,0,"AT2G26140","Encodes an FtsH protease that is localized to the mitochondrion. Loss of function results in increased determinacy of the meristem that is exacerbated when plants are grown at higher temperatures.","FTSH PROTEASE 4 (ftsh4)","AT2G26140.1","FTSH4",0.215,0.832,0.539,-0.191,0.705,0.786,-0.18,-0.155
"211","aSSPEEIAkR","AT4G35850.1","N-Term(iTRAQ8plex); K9(iTRAQ8plex)",0.87,0.98,0.98,1.08,1.03,1.05,1.31,0.88,0.99,1.01,0.88,1.02,1.09,0.42,0,1,0.42,0,"AT4G35850","Pentatricopeptide repeat (PPR) superfamily protein;(source:Araport11)","","AT4G35850.1","Pentatricopeptide repeat-containing protein At4g35850, mitochondrial",0.0766,0.28,0.421,0.575,0.0666,0.572,0.373,0.223
"212","aVLSSADR","AT3G51840.1","N-Term(iTRAQ8plex)",0.33,1.63,0.96,1.12,0.52,1.92,0.93,1.04,0.27,1.48,1.06,0.86,1.09,0.82,0,0.91,0.82,0,"AT3G51840","Encodes a short-chain acyl-CoA oxidase, which catalyzes the first step of peroxisomal fatty acid beta-oxidation during early, post-germinative growth in oilseed species. Null mutants virtually lack short-chain acyl-CoA and are resistant to 2,4-dichlorophenoxybutyric acid, which is converted to the herbicide and auxin analogue 2,4-dichlorophenoxyacetic acid by beta-oxidation. Despite the almost complete loss of short-chain activity, lipid catabolism and seedling growth and establishment was unaltered in the acx4 mutant. However, double mutants in acx3acx4 (acx3 encodes medium chain acyl CoA oxidase) were not viable and arrested during embryogenesis.","ACYL-COA OXIDASE 4 (ACX4)","AT3G51840.1","ACX4",0.581,0.79,-0.52,0.563,0.813,0.847,0.0977,0.0473
"213","tHGVDTLAHQkWSGANYYDR","AT3G21720.1","N-Term(iTRAQ8plex); K11(iTRAQ8plex)",0.98,0.96,0.82,0.91,0.99,1.01,1,1,1.22,1.71,1.39,2.02,1.09,0.11,0,1.73,0.11,0,"AT3G21720","Encodes a glyoxylate cycle enzyme isocitrate lyase (ICL).","ISOCITRATE LYASE (ICL)","AT3G21720.1","ICL",0.742,0.127,0.0961,1.06,0.417,0.0103,0.315,0.967
"218","sGSISFDTEkPGHTGEPR","AT4G27585.1","N-Term(iTRAQ8plex); K10(iTRAQ8plex)",0.96,1.02,0.43,1.47,0.76,0.98,0.53,1.93,1.02,1.04,0.41,1.8,1.09,0.83,0,1.1,0.83,0,"AT4G27585","Encodes a stomatin-like protein that is present in a mitochondrial membrane-bound 3 MDa protein complex and is involved in the assembly of mitochondrial respiratory supercomplexes.  There is an observed increase in abundance of respiratory complex III2 in SLP1 single and double knockout mutants. The protein is not redundant with Arabidopsis SLP2 (At5g54100).","STOMATIN-LIKE PROTEIN 1 (SLP1)","AT4G27585.1","SPFH/Band 7/PHB domain-containing membrane-associated protein family",0.306,0.545,-0.826,-1.18,0.839,0.851,0.000371,0.0261
"219","sTDFGYETTTAAR","AT5G62810.1","N-Term(iTRAQ8plex)",1.19,0.61,0.82,0.77,0.84,0.76,1.05,1.02,1.19,1.16,0.98,1.25,1.08,0.64,0,1.35,0.64,0,"AT5G62810","mutant has a defect in the intracellular transport of thiolase from the cytosol to glyoxysomes (formerly known as ped2) The mRNA is cell-to-cell mobile.","PEROXIN 14 (PEX14)","AT5G62810.1","PEX14",0.416,0.844,-0.779,0.308,0.771,0.756,0.223,0.4
"222","tEDNIRDEAR","AT4G29840.1","N-Term(iTRAQ8plex)",1,1.02,0.99,0.97,0.9,1.12,1.01,1.28,0.67,1,1.01,0.97,1.08,0.4,0,0.91,0.4,0,"AT4G29840","threonine synthase","METHIONINE OVER-ACCUMULATOR 2 (MTO2)","AT4G29840.1","TS1",0.742,0.315,-0.185,-1.52,0.108,0.8,-0.953,-0.22
"225","dTGEIGGPR","AT5G67490.1","N-Term(iTRAQ8plex)",1.08,0.85,0.54,1.04,1.27,0.55,0.85,1.11,1.08,0.92,0.96,1.2,1.08,0.75,0,1.19,0.75,0,"AT5G67490","SDHAF4 acts on FAD-SDH1 and promotes its assembly with SDH2, thereby stabilizing SDH2 and enabling its full assembly with SDH3/SDH4 to form the SDH complex.","SUCCINATE DEHYDROGENASE ASSEMBLY FACTOR 4 (SDHAF4)","AT5G67490.1"," succinate dehydrogenase assembly factor ",0.697,0.87,0.575,0.188,0.686,0.78,0.676,-0.57
"226","sGIYYYTDEQER","AT4G25130.1","N-Term(iTRAQ8plex)",1,1.03,0.89,0.86,0.97,1.02,0.96,1.12,0.93,1,1.04,1.24,1.07,0.25,0,1.11,0.25,0,"AT4G25130","Encodes a chloroplast-localized methionine sulfoxide reductase that is a member of the MSRA family. Involved in protection of chloroplasts from oxidative stress.","PEPTIDE MET SULFOXIDE REDUCTASE 4 (PMSR4)","AT4G25130.1","MSR4",0.783,0.803,0.0209,-0.125,0.292,0.679,0.2,0.136
"233","sTTQVQDGVR","AT4G35630.1","N-Term(iTRAQ8plex)",1.02,1.33,0.96,0.93,0.98,1.24,1.04,1.24,0.79,0.8,1.16,0.67,1.06,0.59,0,0.8,0.59,0,"AT4G35630","Encodes a phosphoserine aminotransferase which is involved in serine biosynthesis in the chloroplast which operates via the phosphorylated pathway. The mRNA is cell-to-cell mobile.","PHOSPHOSERINE AMINOTRANSFERASE 1 (PSAT1)","AT4G35630.1","PSAT1",0.69,0.765,-0.23,-0.454,0.366,0.704,0.509,0.346
"234","gTETVLVAR","AT3G21720.1","N-Term(iTRAQ8plex)",0.85,1.2,1.42,0.53,2.2,0.73,0.17,1.14,1.15,0.42,6.22,0.86,1.06,0.9,0,2.16,0.9,0,"AT3G21720","Encodes a glyoxylate cycle enzyme isocitrate lyase (ICL).","ISOCITRATE LYASE (ICL)","AT3G21720.1","ICL",0.742,0.127,0.0961,1.06,0.417,0.0103,0.315,0.967
"240","gASQLmNEPLNDQR","AT5G66120.2","N-Term(iTRAQ8plex); M6(Oxidation)",1.01,1.02,1.01,1.11,0.99,1.08,1.3,0.99,0.78,0.98,0.79,0.97,1.05,0.51,0,0.85,0.51,0,"AT5G66120","3-dehydroquinate synthase;(source:Araport11)","","AT5G66120.2","DHQS",0.681,0.432,-0.169,-0.716,0.788,0.519,-0.0824,-0.382
"241","aQTTAPAESTASVDADR","AT2G15620.1","N-Term(iTRAQ8plex)",0.98,1.06,0.89,1.11,1.02,1.09,0.96,1.19,0.88,0.93,1.03,0.97,1.05,0.47,0,0.94,0.47,0,"AT2G15620","Involved in the second step of nitrate assimilation.  Its expression is induced by nitrate. The mRNA is cell-to-cell mobile.","NITRITE REDUCTASE 1 (NIR1)","AT2G15620.1","NIR1",0.768,0.561,-0.0848,-0.751,0.0176,0.666,0.916,0.355
"246","yLDGSLPGDYGFDPLGLSDPEGTGGFIEPR","AT1G61520.3","N-Term(iTRAQ8plex)",0.89,1.22,1.07,1.15,1.22,1.11,0.93,1.28,0.34,0.47,0.6,0.78,1.05,0.65,0,0.5,0.65,0,"AT1G61520","PSI type III chlorophyll a/b-binding protein (Lhca3*1) The mRNA is cell-to-cell mobile.","PHOTOSYSTEM I LIGHT HARVESTING COMPLEX GENE 3 (LHCA3)","AT1G61520.2","LHCA3",0.763,0.85,0.249,-0.429,0.435,0.609,-1.11,-1.11
"247","sSSSDLPPHQEIGMPSLSPTMTEGNIAR","AT3G13930.1","N-Term(iTRAQ8plex)",0.96,1.1,0.91,1.12,0.98,1.07,1.09,1.13,1.02,0.68,0.88,0.71,1.04,0.5,0,0.8,0.5,0,"AT3G13930","Encodes a subunit of the mitochondrial pyruvate dehydrogenase complex.","MITOCHONDRIAL PYRUVATE DEHYDROGENASE SUBUNIT 2-2 (MTE2-2)","AT3G13930.1","Dihydrolipoyllysine-residue acetyltransferase component 2 of pyruvate dehydrogenase complex, mitochondrial",0.467,0.797,-0.16,-0.126,0.0215,0.153,-0.341,-0.335
