"","Sequence","prot_acc","Modifications","col-0.1","col-0.2","col-0.3","col-0.4","clp1.1","clp1.2","clp1.3","clp1.4","clp2.1","clp2.2","clp2.3","clp2.4","clp1/col-0 Ratio","clp1/col-0 TTEST","clp1/col-0 REGULATION","clp2/col-0 Ratio","clp2/col-0 TTEST","clp2/col-0 REGULATION","gene","Gene Model Name","Gene Model Type","ID","name","clp1p__vs_wtp__p.adj","clp2p__vs_wtp__p.adj","clp1p__vs_wtp__ratio","clp2p__vs_wtp__ratio","clp1s__vs_wts__p.adj","clp2s__vs_wts__p.adj","clp1s__vs_wts__ratio","clp2s__vs_wts__ratio"
"390","pSEAESSANSAPATPPPPPNFWGTMPEEEYYTSQGVR","AT1G52760.1","N-Term(iTRAQ8plex)",1.05,1.28,1.06,0.98,1,1,0.9,1.03,0.77,0.51,1.02,0.9,0.9,0.19,0,0.73,0.19,0,"AT1G52760","Encodes caffeoyl shikimate esterase and is involved in lignin biosynthesis. CSE converts caffeoyl shikimate to caffiate. Loss of function mutations have reduced lignin content and collapsed vessel elements. It is also reported to function as a lysophospholipase 2 (LysoPL2) involved in tolerance to cadmium-induced oxidative stress.  Binds Acyl-CoA-binding protein 2 (ACBP2).","LYSOPHOSPHOLIPASE 2 (LysoPL2)","AT1G52760.1","CSE",0.726,0.683,0.197,-0.7,0.388,0.423,-0.557,-0.715
"398","gNDLWYGPDR","AT5G54270.1","N-Term(iTRAQ8plex)",1.08,1.04,1.38,1.13,1.23,0.96,1.13,0.82,0.75,0.69,0.86,0.87,0.89,0.33,0,0.68,0.33,0,"AT5G54270","Lhcb3 protein is a component of the main light harvesting chlorophyll a/b-protein complex of Photosystem II (LHC II).","LIGHT-HARVESTING CHLOROPHYLL B-BINDING PROTEIN 3 (LHCB3)","AT5G54270.1","LHCB3",0.789,0.877,-0.0825,0.0563,0.836,0.393,0.0197,-1.24
"405","tVDEAAPGLR","AT3G01280.1","N-Term(iTRAQ8plex)",1.04,0.99,1.59,0.88,1.3,1.01,0.68,0.98,0.91,0.89,2.47,1.02,0.88,0.54,0,1.17,0.54,0,"AT3G01280","Encodes a voltage-dependent anion channel (VDAC: AT3G01280/VDAC1, AT5G67500/VDAC2, AT5G15090/VDAC3, AT5G57490/VDAC4, AT5G15090/VDAC5). VDACs are reported to be porin-type, beta-barrel diffusion pores. They are prominently localized in the outer mitochondrial membrane and are involved in metabolite exchange between the organelle and the cytosol. The mRNA is cell-to-cell mobile.","VOLTAGE DEPENDENT ANION CHANNEL 1 (VDAC1)","AT3G01280.1","VDAC1",0.0356,0.517,-1.88,-1.59,0.806,0.697,-0.145,-0.622
"407","sDETVAmIEAYLR","AT2G05710.1","N-Term(iTRAQ8plex); M7(Oxidation)",0.94,1.04,1.14,1.03,0.8,1,0.87,0.99,1,1.17,0.81,1.01,0.88,0.09,0,0.96,0.09,0,"AT2G05710","Encodes an aconitase that can catalyze the conversion of citrate to isocitrate through a cis-aconitate intermediate, indicating that it may participate in the TCA cycle and other primary metabolic pathways. The protein is believed to accumulate in the mitochondria and the cytosol. It affects CSD2 (At2g28190 - a superoxide dismutase) transcript levels and may play a role in the response to oxidative stress. One member of the family (ACO1 - At35830) was shown to specifically bind to the 5' UTR of CSD2 in vitro. ACO3 is tyrosine-phosphorylated and its phosphorylation state is modulated in response to ABA in Arabidopsis thaliana seeds. The mRNA is cell-to-cell mobile.","ACONITASE 3 (ACO3)","AT2G05710.1","ACO2.1",0.204,0.601,-0.261,-0.275,0.212,0.402,-0.224,-0.235
"408","vSSSEVLSL","AT5G61220.3","N-Term(iTRAQ8plex)",1.19,0.9,1.79,0.71,0.92,1.13,0.93,1.07,1.01,0.99,1.82,0.66,0.88,0.61,0,0.98,0.61,0,"AT5G61220","LYR family of Fe/S cluster biogenesis protein;(source:Araport11)","","AT5G61220.3","LYR family of Fe/S cluster biogenesis protein",0.702,0.872,-0.0914,-0.0265,0.494,0.7,-0.181,-0.152
"409","qAVTTDTR","AT1G58270.1","N-Term(iTRAQ8plex)",1.04,0.93,1.16,0.96,1.09,0.92,0.82,0.77,1.13,0.96,1.08,1.04,0.88,0.21,0,1.03,0.21,0,"AT1G58270","ZW9 mRNA, complete cds The mRNA is cell-to-cell mobile.","(ZW9)","AT1G58270.1","ZW9",0.722,0.829,-0.18,-0.264,0.793,0.376,-0.109,-0.688
"410","gSSAASLIQR","AT4G36400.2","N-Term(iTRAQ8plex)",1.09,1.1,1.06,1.31,1.05,0.9,0.83,1.24,0.95,0.88,0.82,0.94,0.88,0.26,0,0.78,0.26,0,"AT4G36400","Encodes a (D)-2-hydroxyglutarate dehydrogenase.","D-2-HYDROXYGLUTARATE DEHYDROGENASE (D2HGDH)","AT4G36400.2","D2HGDH",0.711,0.847,-0.152,-0.145,0.0551,0.831,-0.664,-0.0678
"411","dGPVcPPSNkLSR","AT3G09260.1","N-Term(iTRAQ8plex); C5(Carbamidomethyl); K10(iTRAQ8plex)",0.94,1.05,0.9,1.11,0.73,1.03,0.75,1,1.14,0.97,1.48,1,0.88,0.25,0,1.15,0.25,0,"AT3G09260","Encodes beta-glucosidase.The major constituent of ER bodies. One of the most abundant proteins in Arabidopsis seedlings. Exist in an soluble (inactive) and non-soluble (active) form, most probably formed in a polymerization process. Involved in the mutualistic interaction between Arabidopsis and the endophytic fungus Piriformospora indica.","(PYK10)","AT3G09260.1","BGLU23",0.286,0.394,-2.18,-3.78,0.836,0.853,0.0362,-0.0435
"413","nFDDNAAFR","AT2G20420.1","N-Term(iTRAQ8plex)",1.19,1.15,1.14,1.07,1.02,0.98,0.89,1.09,0.83,0.92,0.93,0.86,0.87,0.03,0,0.78,0.03,0,"AT2G20420","ATP citrate lyase (ACL) family protein;(source:Araport11)","","AT2G20420.1","Succinyl-CoA ligase [ADP-forming] subunit beta, mitochondrial",0.0533,0.494,-0.343,-0.32,0.095,0.455,-0.264,-0.206
"415","fSTSANPQQQASPPPPSLAGEESSAPPR","AT3G03060.1","N-Term(iTRAQ8plex)",0.96,1.33,1,1.01,1.04,0.9,0.81,1,1.29,0.94,1.1,0.57,0.87,0.22,0,0.91,0.22,0,"AT3G03060","P-loop containing nucleoside triphosphate hydrolases superfamily protein;(source:Araport11)","","AT3G03060.1","P-loop containing nucleoside triphosphate hydrolases superfamily protein.1",0.631,0.839,-0.444,-0.322,0.783,0.652,-0.185,-0.598
"416","aGAVDcPGSPkSVR","AT5G27540.1","N-Term(iTRAQ8plex); C6(Carbamidomethyl); K11(iTRAQ8plex)",0.57,1.53,1.14,0.97,0.61,1.33,0.85,0.87,0.77,1.23,4.03,1.03,0.87,0.61,0,1.68,0.61,0,"AT5G27540","Encodes a protein with similarity to GTPases that is localized to the mitochondrion. Involved in embryogenesis, pollen tube growth and required for mitochondrial development.","MIRO-RELATED GTP-ASE 1 (MIRO1)","AT5G27540.2","MIRO1",0.695,0.776,0.323,0.617,0.73,0.774,-0.298,-0.332
"417","mDTEFLR","AT5G17770.1","N-Term(iTRAQ8plex); M1(Oxidation)",1,1.1,1.06,0.99,0.86,1,0.73,1.01,1.16,0.81,1.06,0.79,0.87,0.13,0,0.92,0.13,0,"AT5G17770","Encodes NADH:cytochrome (Cyt) b5 reductase that displayed strict specificity to NADH for the reduction of a recombinant Cyt b5 (AtB5-A), whereas no Cyt b5 reduction was observed when NADPH was used as the electron donor.","NADH:CYTOCHROME B5 REDUCTASE 1 (CBR)","AT5G17770.1","CBR1",0.804,0.854,0.00182,-0.189,0.785,0.773,-0.147,-0.274
"419","sDPVVSFR","AT1G56070.3","N-Term(iTRAQ8plex)",1.31,1.43,1.08,0.92,0.78,1.04,1.38,0.92,0.84,0.96,1.48,0.82,0.87,0.4,0,0.86,0.4,0,"AT1G56070","encodes a translation elongation factor 2-like protein that is involved in cold-induced translation. Mutations in this gene specifically blocks low temperature-induced transcription of cold-responsive genes but induces the expression of CBF genes and mutants carrying the recessive mutations fail to acclimate to cold and is freezing sensitive.","LOW EXPRESSION OF OSMOTICALLY RESPONSIVE GENES 1 (LOS1)","AT1G56070.3","LOS1",0.74,0.611,0.154,-0.768,0.683,0.831,-0.27,-0.091
"420","tQPSQALLYR","AT1G76150.1","N-Term(iTRAQ8plex)",1.07,1.02,0.97,1.09,0.82,0.95,0.85,0.97,0.98,1.44,1.03,1.38,0.87,0.03,0,1.17,0.03,0,"AT1G76150","Encodes a monofunctional enoyl-CoA hydratase 2, involved in the degradation of even cis-unsaturated fatty acids, gene expression is enhanced during the first 2 days of germination, as well as in senescent leaves.","ENOYL-COA HYDRATASE 2 (ECH2)","AT1G76150.1","ECH2",0.62,0.734,0.337,0.554,0.815,0.796,-0.0668,0.193
"422","sVETSSEEILAFFR","AT1G24180.1","N-Term(iTRAQ8plex)",1.04,1.01,1.1,1.02,0.92,1.04,0.68,0.98,0.82,0.99,0.74,1.02,0.87,0.18,0,0.85,0.18,0,"AT1G24180","Arabidopsis thaliana pyruvate dehydrogenase E1a-like subunit. 81% identical to a previously characterized Arabidopsis mitochondrial PDH E1a-subunit, At1g59900. Serine 296 phosphorylation of IAR4 has critical function in root hair formation and root development. Changing Ser296 in IAR4 to Ala resulted in a phenotype intermediate between mutant and wild-type, while substitution to Asp was either lethal or caused an extreme dwarf phenotype.","IAA-CONJUGATE-RESISTANT 4 (IAR4)","AT1G24180.1","IAR4",0.281,0.541,-0.208,-0.285,0.00399,0.0285,-0.387,-0.431
"423","gQEAAPTGPPNR","AT2G35720.1","N-Term(iTRAQ8plex)",1.07,1.03,1.32,1.05,1.1,0.97,0.92,0.89,0.91,0.9,1.1,0.95,0.87,0.13,0,0.86,0.13,0,"AT2G35720","Encodes OWL1, a J-domain protein involved in perception of very low light fluences.","ORIENTATION UNDER VERY LOW FLUENCES OF LIGHT 1 (OWL1)","AT2G35720.1","ATJ13",0.589,0.803,-0.537,-0.535,0.745,0.762,0.283,-0.384
"425","aNPTENLDANPQIR","AT3G11070.1","N-Term(iTRAQ8plex)",1.03,1.23,1.07,1.13,1,0.97,0.91,0.99,1,0.94,0.93,1.01,0.87,0.03,0,0.87,0.03,0,"AT3G11070","Outer membrane OMP85 family protein;(source:Araport11)","","AT3G11070.1","Outer membrane OMP85 family protein",0.795,0.863,0.0278,0.109,0.815,0.85,-0.0627,-0.0216
"427","sLRENSTSQFR","AT4G26410.1","N-Term(iTRAQ8plex)",1.01,1.08,1.3,0.86,0.76,0.99,0.91,1.02,0.98,1.02,3.39,0.98,0.87,0.24,0,1.5,0.24,0,"AT4G26410","Encodes a protein predicted to have a 3-stranded helical structure that interacts with both AtRGS1 and AtHXK1 in planta and is required for some glucose-regulated gene expression.","RGS1-HXK1 INTERACTING PROTEIN 1 (RHIP1)","AT4G26410.1","Uncharacterised conserved protein UCP022280.1",0.794,0.414,0.026,-0.898,0.804,0.766,-0.0734,-0.208
"429","gADSPAITESR","AT5G19550.1","N-Term(iTRAQ8plex)",1.01,1.73,1.04,0.59,1.09,0.94,1.1,0.63,0.91,0.99,1.43,0.96,0.86,0.59,0,0.98,0.59,0,"AT5G19550","Nitrogen metabolism. Major cytosolic isoenzyme controlling aspartate biosynthesis in the light. The mRNA is cell-to-cell mobile.","ASPARTATE AMINOTRANSFERASE 2 (ASP2)","AT5G19550.1","ASP2",0.682,0.877,-0.196,0.0229,0.834,0.832,-0.0123,-0.0686
"432","dDQTVLYESFDEPFDGR","AT5G61790.1","N-Term(iTRAQ8plex)",0.96,1.39,0.91,1.26,1.04,0.84,0.95,1.05,1.07,0.94,1.11,0.88,0.86,0.27,0,0.88,0.27,0,"AT5G61790","calnexin 1;(source:Araport11)","CALNEXIN 1 (CNX1)","AT5G61790.1","CNX1",0.785,0.609,-0.0713,-0.97,0.221,0.766,0.8,0.318
"434","sQSSNDTFPTVMHIAAATEINSR","AT2G47510.3","N-Term(iTRAQ8plex)",1.07,1,1.24,1.04,0.96,1,0.82,0.96,0.96,1.14,0.94,1.09,0.86,0.06,0,0.95,0.06,0,"AT2G47510","Encodes a mitochondrial-localized protein. The FUM1 gene appears to be essential, suggesting that FUM1 may play a crucial role as a fumarase in the tricarboxylic acid cycle.","FUMARASE 1 (FUM1)","AT2G47510.3","FUM1",0.115,0.575,-0.317,-0.3,0.32,0.327,-0.2,-0.276
"436","dVSPSYESLVDGSGR","AT3G06810.1","N-Term(iTRAQ8plex)",0.75,1.64,1.04,1.16,0.89,1.11,0.91,1.02,0.68,1.16,0.86,0.98,0.86,0.45,0,0.8,0.45,0,"AT3G06810","Encodes a protein with similarity to acyl-CoA dehydrogenases. Mutations in IBR3 render   plants resistant to indole-3-butryic acid, a putative storage form of the biologically active auxin IAA  (indole-3-acetic acid). IBR3 is hypothesized to carry out the second step in a  &#946;-oxidation-like process of IBA metabolism in Arabidopsis.  Though its subcellular location has not been determined, IBR3 has a peroxisomal targeting  sequence and  two other putative IBA metabolic enzymes (IBR1 and IBR10)  can be found in this organelle. No specific enzymatic activity has been  documented for IBR3, but double mutant analyses with CHY1 argue against a role for IBR3 in general fatty  acid &#946;-oxidation. The mRNA is cell-to-cell mobile.","IBA-RESPONSE 3 (IBR3)","AT3G06810.1","IBR3",0.793,0.797,0.0369,-0.414,0.831,0.853,0.0254,-0.0115
"437","sMDAQSVSEkLR","AT1G79440.1","N-Term(iTRAQ8plex); K10(iTRAQ8plex)",1.09,1.94,0.64,1.27,0.88,0.91,0.73,1.69,1.09,0.81,0.62,1.46,0.85,0.62,0,0.8,0.62,0,"AT1G79440","Encodes a mitochondrial succinic semialdehyde dehydrogenase (SSADH).  Nomenclature according to Kirch, et al (2004).","ALDEHYDE DEHYDROGENASE 5F1 (ALDH5F1)","AT1G79440.1","ALDH5F1",0.294,0.703,-0.351,-0.332,0.223,0.212,-0.348,-0.502
"441","mIEHGNSTFDYR","AT1G25380.1","N-Term(iTRAQ8plex); M1(Oxidation)",1.12,0.99,1.15,0.94,1.01,0.83,0.68,1.06,1.01,0.85,1.09,0.86,0.85,0.18,0,0.91,0.18,0,"AT1G25380","Encodes a mitochondrial-localized NAD+ transporter that transports NAD+ in a counter exchange mode with ADP and AMP in vitro.","NAD+ TRANSPORTER 2 (NDT2)","AT1G25380.2","NDT2",0.773,0.809,0.134,-0.535,0.0962,0.512,-1.25,-0.896
"443","aAGGDDLEAGR","AT1G16870.1","N-Term(iTRAQ8plex)",1.34,1.31,1.05,0.83,0.79,1.13,1.12,0.8,0.57,0.87,1.15,0.95,0.85,0.31,0,0.78,0.31,0,"AT1G16870","mitochondrial 28S ribosomal protein S29-like protein;(source:Araport11)","","AT1G16870.1","mitochondrial 28S ribosomal protein S29-related",0.037,0.692,0.82,0.464,0.2,0.473,0.487,0.453
"447","eVYHPNALR","AT3G26520.1","N-Term(iTRAQ8plex)",1.13,1.43,1.1,0.91,0.84,1,1.06,0.94,1,0.78,1.12,0.76,0.84,0.2,0,0.8,0.2,0,"AT3G26520","gamma tonoplast intrinsic protein 2 (TIP2). expressed throughout the plant and transcript level is increased upon NaCl or ABA treatments. NaCl stress-sensitive yeast mutant strains exhibit more resistance to salt when expressing this protein.","TONOPLAST INTRINSIC PROTEIN 2 (TIP2)","AT3G26520.1","TIP1-2",0.752,0.709,0.198,-0.901,0.736,0.0487,-0.312,-1.91
"449","sIPEGAVVcNVEHHVGDRGVLAR","AT2G18020.1","N-Term(iTRAQ8plex); C9(Carbamidomethyl)",2.02,1.03,0.97,0.94,0.81,1.01,1.05,1.31,0.89,0.99,1.03,0.89,0.84,0.52,0,0.77,0.52,0,"AT2G18020","Ribosomal protein L2 family;(source:Araport11)","EMBRYO DEFECTIVE 2296 (EMB2296)","AT2G18020.1","RPL8A",0.784,0.832,-0.0702,-0.312,0.689,0.23,-0.316,-1.07
"450","sIPEGAVVcNVEHHVGDRGVLAR","AT2G18020.1","N-Term(iTRAQ8plex); C9(Carbamidomethyl)",2.02,1.03,0.97,0.94,0.81,1.01,1.05,1.31,0.89,0.99,1.03,0.89,0.84,0.52,0,0.77,0.52,0,"AT2G18020","Ribosomal protein L2 family;(source:Araport11)","EMBRYO DEFECTIVE 2296 (EMB2296)","AT2G18020.1","RPL8C",0.626,0.765,-0.386,-0.562,0.713,0.304,-0.281,-0.96
"451","aAGAkEMTVR","AT5G50850.1","N-Term(iTRAQ8plex); K5(iTRAQ8plex)",1.06,0.99,1.16,1.01,0.81,0.93,0.93,0.87,1.05,1.01,1,1,0.84,0.01,0,0.96,0.01,0,"AT5G50850","Transketolase family protein;(source:Araport11)","MACCI-BOU (MAB1)","AT5G50850.1","PDH2",0.721,0.778,-0.0642,-0.148,0.15,0.298,-0.244,-0.276
"454","tTVEEDLDTR","AT5G08060.1","N-Term(iTRAQ8plex)",1.28,1.43,1,1.01,1.44,0.67,1,0.83,0.55,0.72,1.35,0.86,0.83,0.37,0,0.74,0.37,0,"AT5G08060","furry;(source:Araport11)","","AT5G08060.1","B14.5a",0.234,0.631,-0.829,-0.848,0.778,0.736,-0.163,-0.359
"455","sGFAmTEPQVASSDATNIEcSIR","AT3G06810.1","N-Term(iTRAQ8plex); M5(Oxidation); C20(Carbamidomethyl)",1.07,1.01,1.19,1.06,0.99,0.89,0.78,0.94,0.88,1.08,0.9,1.12,0.83,0.02,0,0.92,0.02,0,"AT3G06810","Encodes a protein with similarity to acyl-CoA dehydrogenases. Mutations in IBR3 render   plants resistant to indole-3-butryic acid, a putative storage form of the biologically active auxin IAA  (indole-3-acetic acid). IBR3 is hypothesized to carry out the second step in a  &#946;-oxidation-like process of IBA metabolism in Arabidopsis.  Though its subcellular location has not been determined, IBR3 has a peroxisomal targeting  sequence and  two other putative IBA metabolic enzymes (IBR1 and IBR10)  can be found in this organelle. No specific enzymatic activity has been  documented for IBR3, but double mutant analyses with CHY1 argue against a role for IBR3 in general fatty  acid &#946;-oxidation. The mRNA is cell-to-cell mobile.","IBA-RESPONSE 3 (IBR3)","AT3G06810.1","IBR3",0.793,0.797,0.0369,-0.414,0.831,0.853,0.0254,-0.0115
"458","aAkDISFGIGAR","AT3G13860.1","N-Term(iTRAQ8plex); K3(iTRAQ8plex)",0.94,1.27,1.02,1.01,0.75,0.98,0.99,0.78,1.02,1.06,1.11,0.95,0.83,0.11,0,0.98,0.11,0,"AT3G13860","heat shock protein 60-3A;(source:Araport11)","HEAT SHOCK PROTEIN 60-3A (HSP60-3A)","AT3G13860.1","HSP60-3A",0.781,0.863,-0.0203,0.0352,0.348,0.371,-0.168,-0.224
"461","fSSGSVPER","AT1G53240.1","N-Term(iTRAQ8plex)",1.17,1.08,1.16,1,0.91,0.83,1,0.87,0.92,1.09,1.4,0.93,0.82,0.01,0,0.98,0.01,0,"AT1G53240","mMDH1 encodes a mitochrondrial malate dehydrogenase. It is expressed at higher levels than the other mitochrondrial isoform mMDH2 (At3G15020) according to transcript and proteomic analyses.","MITOCHONDRIAL MALATE DEHYDROGENASE 1 (mMDH1)","AT1G53240.1","mMDH1",0.661,0.854,-0.117,0.0682,0.78,0.827,-0.0575,0.0435
"462","vTYMPRPGDGAPR","AT4G35260.1","N-Term(iTRAQ8plex)",1.24,1.23,1.22,1.13,0.98,1,0.89,1.08,1,0.93,0.91,0.92,0.82,0,0,0.78,0,0,"AT4G35260","Encodes a regulatory subunit of the mitochondrially-localized NAD+- dependent isocitrate dehydrogenase.","ISOCITRATE DEHYDROGENASE 1 (IDH1)","AT4G35260.1","IDH1",0.187,0.743,-0.273,-0.185,0.17,0.2,-0.244,-0.331
"466","vSSSEVLSLcR","AT5G61220.3","N-Term(iTRAQ8plex); C10(Carbamidomethyl)",1.17,1.13,1.46,0.86,0.64,0.97,1.04,1.11,1.03,0.88,0.88,0.96,0.82,0.23,0,0.81,0.23,0,"AT5G61220","LYR family of Fe/S cluster biogenesis protein;(source:Araport11)","","AT5G61220.3","LYR family of Fe/S cluster biogenesis protein",0.702,0.872,-0.0914,-0.0265,0.494,0.7,-0.181,-0.152
"473","aEQQLVNDPSR","AT5G19550.1","N-Term(iTRAQ8plex)",0.98,2.58,0.96,0.63,0.91,1.02,1.2,1.01,0.97,1.03,1.42,0.99,0.8,0.6,0,0.86,0.6,0,"AT5G19550","Nitrogen metabolism. Major cytosolic isoenzyme controlling aspartate biosynthesis in the light. The mRNA is cell-to-cell mobile.","ASPARTATE AMINOTRANSFERASE 2 (ASP2)","AT5G19550.1","ASP2",0.682,0.877,-0.196,0.0229,0.834,0.832,-0.0123,-0.0686
"474","sPSSFTPcLDGR","AT5G49555.1","N-Term(iTRAQ8plex); C8(Carbamidomethyl)",1.09,1.04,1.17,1.05,0.68,0.95,0.9,0.95,0.96,1.04,0.95,1.13,0.8,0.04,0,0.94,0.04,0,"AT5G49555","FAD/NAD(P)-binding oxidoreductase family protein;(source:Araport11)","","AT5G49555.1","FAD/NAD(P)-binding oxidoreductase family protein.1",0.509,0.38,-0.382,-0.98,0.453,0.774,-0.398,-0.204
"475","gFPNVHSR","AT1G54010.1","N-Term(iTRAQ8plex)",1.37,1.05,1.12,0.77,0.85,0.95,0.79,0.88,0.85,1.06,2.13,1.21,0.8,0.18,0,1.22,0.18,0,"AT1G54010","GDSL-motif  esterase/acyltransferase/lipase. Enzyme group with broad substrate specificity that may catalyze acyltransfer or hydrolase reactions with lipid and non-lipid substrates.","GDSL-LIKE LIPASE 23 (GLL23)","AT1G54010.1","GLL23",0.0615,0.505,-1.87,-1.76,0.805,0.703,-0.163,-0.66
"476","sGYEAYLVTHNLLISHAEAVEAYR","AT3G09260.1","N-Term(iTRAQ8plex)",1.04,0.86,0.98,2.24,0.84,1.14,1.14,0.98,1.11,0.96,1.02,0.8,0.8,0.49,0,0.76,0.49,0,"AT3G09260","Encodes beta-glucosidase.The major constituent of ER bodies. One of the most abundant proteins in Arabidopsis seedlings. Exist in an soluble (inactive) and non-soluble (active) form, most probably formed in a polymerization process. Involved in the mutualistic interaction between Arabidopsis and the endophytic fungus Piriformospora indica.","(PYK10)","AT3G09260.1","BGLU23",0.286,0.394,-2.18,-3.78,0.836,0.853,0.0362,-0.0435
"483","sTAADNQTQVGIR","AT5G09590.1","N-Term(iTRAQ8plex)",1.44,3.06,2.37,0.91,4.19,0.56,0.6,0.76,0.27,0.48,5.31,1.09,0.79,0.7,0,0.92,0.7,0,"AT5G09590","heat shock protein 70 (Hsc70-5); nuclear","MITOCHONDRIAL HSO70 2 (MTHSC70-2)","AT5G09590.1","HSP70-10",0.536,0.757,0.129,0.151,0.584,0.639,0.112,0.136
"484","sLLSLNDLR","AT5G64670.1","N-Term(iTRAQ8plex)",1.14,1.07,1.21,1.16,0.89,0.96,0.78,0.96,1.04,0.89,1.04,0.88,0.79,0,0,0.84,0,0,"AT5G64670","Ribosomal protein L18e/L15 superfamily protein;(source:Araport11)","","AT5G64670.1","Ribosomal protein L18e/L15 superfamily protein",0.000611,0.0428,1.07,1.29,2.97e-14,5.04e-14,2.58,2.65
"487","sYTDNQESTTDER","AT5G27540.1","N-Term(iTRAQ8plex)",1.03,1.09,1.29,1.04,0.74,0.97,0.79,0.97,1.07,0.83,0.84,1.03,0.78,0.03,0,0.85,0.03,0,"AT5G27540","Encodes a protein with similarity to GTPases that is localized to the mitochondrion. Involved in embryogenesis, pollen tube growth and required for mitochondrial development.","MIRO-RELATED GTP-ASE 1 (MIRO1)","AT5G27540.2","MIRO1",0.695,0.776,0.323,0.617,0.73,0.774,-0.298,-0.332
"488","sINVENVETNRR","AT3G52930.1","N-Term(iTRAQ8plex)",1,1.99,1.29,0.81,0.84,1.12,1.12,0.88,0.79,1,2.54,0.7,0.78,0.36,0,0.99,0.36,0,"AT3G52930","Aldolase superfamily protein;(source:Araport11)","FRUCTOSE-BISPHOSPHATE ALDOLASE 8 (FBA8)","AT3G52930.1","Aldolase superfamily protein.1",0.421,0.686,-0.811,-0.984,0.000861,0.503,-2.1,-0.901
"492","kAQSAPVPR","AT3G55410.2","N-Term(iTRAQ8plex); K1(iTRAQ8plex)",1.16,1.32,1.36,1.23,0.76,1.15,1.05,0.95,0.85,0.85,0.95,0.87,0.77,0.03,0,0.69,0.03,0,"AT3G55410","2-oxoglutarate dehydrogenase, E1 component;(source:Araport11)","","AT3G55410.2","2-oxoglutarate dehydrogenase, E1 component",0.788,0.811,0.0155,-0.107,0.358,0.553,-0.168,-0.17
"494","fcQATGYGGTVQR","AT1G02410.2","N-Term(iTRAQ8plex); C2(Carbamidomethyl)",1.59,0.82,1.4,1.09,1.18,0.76,0.78,1.03,1.2,0.58,0.97,0.92,0.77,0.21,0,0.75,0.21,0,"AT1G02410","Encodes a member of the cytochrome c oxidase 11 protein family.  It is an integral mitochondrial protein and likely plays an important role as a mitochondrial chaperone in COX complex assembly, affecting plant growth and pollen germination.","CYTOCHROME C OXIDASE 11 (COX11)","AT1G02410.3","COX11",0.787,0.841,-0.0484,-0.218,0.816,0.749,0.0605,-0.277
"496","sLQNFEIGGER","AT2G47510.3","N-Term(iTRAQ8plex)",1.17,1,1.29,1.07,0.87,0.93,0.69,0.96,1,1.04,0.98,1.02,0.76,0.02,0,0.89,0.02,0,"AT2G47510","Encodes a mitochondrial-localized protein. The FUM1 gene appears to be essential, suggesting that FUM1 may play a crucial role as a fumarase in the tricarboxylic acid cycle.","FUMARASE 1 (FUM1)","AT2G47510.3","FUM1",0.115,0.575,-0.317,-0.3,0.32,0.327,-0.2,-0.276
"497","vTNSSNPELEAR","AT1G79390.1","N-Term(iTRAQ8plex)",1.51,1.54,1.65,0.91,1.16,0.67,1.38,1.04,0.84,0.69,0.96,0.71,0.76,0.18,0,0.57,0.18,0,"AT1G79390","centrosomal protein;(source:Araport11)","","AT1G79390.1"," centrosomal protein ",0.702,0.869,0.217,0.081,0.704,0.77,-0.243,0.243
"499","sDETVSmIESYLR","AT4G26970.1","N-Term(iTRAQ8plex); M7(Oxidation)",1.34,1.04,1.05,1.02,0.74,0.96,0.69,0.98,0.95,1.06,1.29,0.88,0.76,0.04,0,0.94,0.04,0,"AT4G26970","Encodes an aconitase that can catalyze the conversion of citrate to isocitrate through a cis-aconitate intermediate, indicating that it may participate in the TCA cycle and other primary metabolic pathways. The protein is believed to accumulate in the mitochondria and the cytosol. It affects CSD2 (At2g28190 - a superoxide dismutase) transcript levels and may play a role in the response to oxidative stress. One member of the family (ACO1 - At35830) was shown to specifically bind to the 5' UTR of CSD2 in vitro. The mRNA is cell-to-cell mobile.","ACONITASE 2 (ACO2)","AT4G26970.1","ACO3",0.0192,0.369,-0.39,-0.373,0.0938,0.304,-0.258,-0.258
"500","sDGkSVYLR","AT4G26970.1","N-Term(iTRAQ8plex); K4(iTRAQ8plex)",1.23,1.05,1.34,1.16,0.82,0.85,0.91,1.04,0.96,1.04,0.96,0.92,0.76,0.01,0,0.81,0.01,0,"AT4G26970","Encodes an aconitase that can catalyze the conversion of citrate to isocitrate through a cis-aconitate intermediate, indicating that it may participate in the TCA cycle and other primary metabolic pathways. The protein is believed to accumulate in the mitochondria and the cytosol. It affects CSD2 (At2g28190 - a superoxide dismutase) transcript levels and may play a role in the response to oxidative stress. One member of the family (ACO1 - At35830) was shown to specifically bind to the 5' UTR of CSD2 in vitro. The mRNA is cell-to-cell mobile.","ACONITASE 2 (ACO2)","AT4G26970.1","ACO3",0.0192,0.369,-0.39,-0.373,0.0938,0.304,-0.258,-0.258
"501","aSDPHPPAAVFVDkNTR","AT5G08300.1","N-Term(iTRAQ8plex); K14(iTRAQ8plex)",0.95,1.49,1.42,1,0.74,0.99,0.99,0.95,1.01,1.2,1.07,1,0.76,0.12,0,0.88,0.12,0,"AT5G08300","Succinyl-CoA ligase, alpha subunit;(source:Araport11)","","AT5G08300.1","Succinyl-CoA ligase [ADP-forming] subunit alpha-1, mitochondrial",0.153,0.713,-0.309,-0.22,0.359,0.617,-0.2,-0.176
"502","tVEEDLDTR","AT5G08060.1","N-Term(iTRAQ8plex)",1.3,1.68,1.05,1.26,1.72,0.54,0.78,0.95,0.7,0.44,1.14,0.75,0.76,0.32,0,0.57,0.32,0,"AT5G08060","furry;(source:Araport11)","","AT5G08060.1","B14.5a",0.234,0.631,-0.829,-0.848,0.778,0.736,-0.163,-0.359
"503","sLGENYSER","AT4G28510.1","N-Term(iTRAQ8plex)",1.32,0.93,1.44,1.05,0.8,0.94,0.84,1,1.1,1.06,0.94,1,0.76,0.09,0,0.86,0.09,0,"AT4G28510","prohibitin 1 (Atphb1)","PROHIBITIN 1 (PHB1)","AT4G28510.1","PHB1",0.709,0.759,0.17,-0.398,0.823,0.835,0.0377,0.0644
"507","mVTGEALIAYR","AT3G62810.1","N-Term(iTRAQ8plex); M1(Oxidation)",1.27,1.77,1.14,1.08,0.97,0.95,1.05,0.95,0.92,1.03,0.8,0.81,0.75,0.12,0,0.68,0.12,0,"AT3G62810","complex 1 family protein / LVR family protein;(source:Araport11)","","AT3G62810.2","complex 1 family protein / LVR family protein",0.802,0.881,-0.0131,0.00377,0.46,0.829,-0.659,0.14
"509","sLQNFEIGGERER","AT2G47510.3","N-Term(iTRAQ8plex)",1.25,1.28,1.31,1.06,0.94,0.98,0.78,0.94,0.97,1.02,0.87,1.07,0.74,0.01,0,0.8,0.01,0,"AT2G47510","Encodes a mitochondrial-localized protein. The FUM1 gene appears to be essential, suggesting that FUM1 may play a crucial role as a fumarase in the tricarboxylic acid cycle.","FUMARASE 1 (FUM1)","AT2G47510.3","FUM1",0.115,0.575,-0.317,-0.3,0.32,0.327,-0.2,-0.276
"510","sSGSVPER","AT1G53240.1","N-Term(iTRAQ8plex)",1.23,0.91,1.52,1.05,0.98,0.97,0.67,0.87,1.02,1.12,1.06,0.95,0.74,0.1,0,0.88,0.1,0,"AT1G53240","mMDH1 encodes a mitochrondrial malate dehydrogenase. It is expressed at higher levels than the other mitochrondrial isoform mMDH2 (At3G15020) according to transcript and proteomic analyses.","MITOCHONDRIAL MALATE DEHYDROGENASE 1 (mMDH1)","AT1G53240.1","mMDH1",0.661,0.854,-0.117,0.0682,0.78,0.827,-0.0575,0.0435
"511","sPDEIAkIHR","AT5G25940.1","N-Term(iTRAQ8plex); K7(iTRAQ8plex)",1.61,1.28,1.07,0.97,0.76,0.95,1.03,0.91,1.05,0.93,1.09,0.95,0.74,0.1,0,0.82,0.1,0,"AT5G25940","early nodulin-like protein;(source:Araport11)","","AT5G25940.1","early nodulin-related",0.286,0.737,-0.631,-0.52,0.837,0.835,0.00655,0.0752
"512","sYGVEFSR","AT5G40770.1","N-Term(iTRAQ8plex)",1.3,1.79,1.61,1.01,1.93,0.7,0.57,0.99,0.53,0.56,1.86,0.81,0.73,0.33,0,0.66,0.33,0,"AT5G40770","prohibitin 3","PROHIBITIN 3 (PHB3)","AT5G40770.1","PHB3",0.49,0.581,-1.3,-2.33,0.828,0.827,0.0887,0.291
